date,news_content,url
2024-10-30,AMD Making 'Great Progress' With AI Giants: Jim Cramer Says AI Chip Story Is 'Not Just Jensen Huang',https://www.benzinga.com/trading-ideas/long-ideas/24/10/41631842/amd-making-great-progress-with-ai-giants-jim-cramer-says-ai-chip-story-is-not-just-jense
2024-10-30,10 Information Technology Stocks With Whale Alerts In Today's Session,https://www.benzinga.com/insights/options/24/10/41632226/10-information-technology-stocks-with-whale-alerts-in-todays-session
2024-10-16,Under the Radar - The Quiet Risks That Drive Market Movements,https://www.benzinga.com/opinion/24/10/41633216/under-the-radar-the-quiet-risks-that-drive-market-movements
2024-10-30,"AMD Earnings Show Power Of Nvidia Software, ADP Data Defies Expectations",https://www.benzinga.com/general/market-summary/24/10/41634837/amd-earnings-show-power-of-nvidia-software-adp-data-defies-expectations
2024-10-30,"Market Clubhouse Morning Memo - October 30th, 2024 (Trade Strategy For SPY, QQQ, AAPL, MSFT, NVDA, GOOGL, META And TSLA)",https://www.benzinga.com/markets/24/10/41634863/market-clubhouse-morning-memo-october-30th-2024-trade-strategy-for-spy-qqq-aapl-msft-nvda-googl-meta
2024-10-30,"AMD Stock Drops On Q4 Outlook As 10 Analysts Highlight 'Long-Term AI Growth Opportunity,' Nvidia Rivalry",https://www.benzinga.com/analyst-ratings/price-target/24/10/41634850/amd-stock-drops-on-q4-outlook-as-10-analysts-highlight-long-term-ai-growth-opportuni
2024-10-30,Mark Zuckerberg Says Meta's Open-Source Gambit Is Paying Off As Nvidia And AMD Optimize For Llama: 'A Big Deal On Several Fronts',https://www.benzinga.com/markets/equities/24/10/41643021/mark-zuckerberg-says-metas-open-source-gambit-is-paying-off-as-nvidia-and-amd-optimize-for-llama
2024-10-31,AMD CEO Lisa Su: No 'One Size Fits All' In $500B AI Computing Future,https://www.benzinga.com/markets/equities/24/10/41643612/amd-ceo-lisa-su-no-one-size-fits-all-in-500b-ai-computing-future
2024-10-31,"Samsung Profits Soar, But Company's Nvidia AI Chip Race Lag Allows SK Hynix, Micron To Take The Lead In High-Bandwidth Memory",https://www.benzinga.com/markets/asia/24/10/41645191/samsung-profits-soar-but-companys-nvidia-ai-chip-race-lag-allows-sk-hynix-micron-to-take-the-lead-in
2024-10-31,AMD's AI Data Center Business Booms: CEO Says It's 'Closed A Good Part Of That Gap' With Nvidia,https://www.benzinga.com/news/earnings/24/10/41652277/amds-ai-data-center-business-booms-ceo-says-its-closed-a-good-part-of-that-gap-with-nvidia
2024-10-31,What's Going On With Taiwan Semiconductor Stock On Thursday?,https://www.benzinga.com/news/24/10/41652503/whats-going-on-with-taiwan-semiconductor-stock-on-thursday
2024-10-31,"Top 10 Trending Stocks On WallStreetBets As Of October 31, 2024 (Via Swaggy Stocks)",https://www.benzinga.com/trading-ideas/24/10/41653484/top-10-trending-stocks-on-wallstreetbets-as-of-october-31-2024-via-swaggy-stocks
2024-10-31,"Here Is Why Investors Do Not Like Good Earnings From Microsoft And Meta, Hotter Inflation Data",https://www.benzinga.com/general/market-summary/24/10/41659920/here-is-why-investors-do-not-like-good-earnings-from-microsoft-and-meta-hotter-inflation-d
2024-10-31,These 10 Stocks Were S&P 500's Top Performers In Biden's First Year: Could Trend Continue If Harris Wins 2024 Election?,https://www.benzinga.com/general/education/24/10/41665149/these-10-stocks-were-s-p-500s-top-performers-in-bidens-first-year-could-the-trend-continue-if-h
2024-11-01,"Andy Jassy Touts 'Deep Partnership' With Nvidia, But Amazon Is Doubling Down On In-House Custom Silicon For Price-Conscious Customers",https://www.benzinga.com/news/24/11/41675183/andy-jassy-touts-deep-partnership-with-nvidia-but-amazon-is-doubling-down-on-in-house-custom-silicon
2024-11-01,"Analyst Throws Support Behind Intel CEO Gelsinger After Better-Than-Expected Q3 Results: 'If You're Questioning Pat As The Leader, Then Who Else?'",https://www.benzinga.com/analyst-ratings/analyst-color/24/11/41685301/analyst-throws-support-behind-intel-ceo-gelsinger-after-better-than-expected-q3-res
2024-11-01,Nvidia's Run:ai Acquisition Draws European Regulatory Scrutiny On Competition Concerns,https://www.benzinga.com/government/24/11/41685490/nvidias-run-ai-acquisition-draws-european-regulatory-scrutiny-on-competition-concerns
2024-11-01,"Top 10 Trending Stocks On WallStreetBets As Of November 1, 2024 (Via Swaggy Stocks)",https://www.benzinga.com/trading-ideas/24/11/41685892/top-10-trending-stocks-on-wallstreetbets-as-of-november-1-2024-via-swaggy-stocks
2024-11-01,Intel Says It Won't Even Make $500M From Gaudi AI Chips In 2024 Despite Nvidia Minting Billions: CEO Gelsinger Says Uptake 'Slower Than We Anticipated',https://www.benzinga.com/markets/equities/24/11/41686435/intel-says-it-wont-even-make-500m-from-gaudi-ai-chips-in-2024-despite-nvidia-minting-billions-ce
2024-11-01,"Apple, Microsoft Need To Do More Than Just Beating Wall Street Estimates, Says Analyst: 'AI Enthusiasm And Potential Is Not Enough""",https://www.benzinga.com/analyst-ratings/analyst-color/24/11/41686408/apple-microsoft-need-to-do-more-than-just-beating-wall-street-estimates-says-analys
2024-10-31,"Jensen Huang Halloween Costume: Move Over Spider-Man, Batman, Nvidia CEO Is 'Like A Superhero' To Young Child In Taiwan",https://www.benzinga.com/news/24/10/41663322/jensen-huang-halloween-costume-move-over-spider-man-batman-nvidia-ceo-is-like-a-superhero-to-young-c
2024-11-01,10 Information Technology Stocks Whale Activity In Today's Session,https://www.benzinga.com/insights/options/24/11/41692094/10-information-technology-stocks-whale-activity-in-todays-session
2024-11-02,"Nvidia Rides AI Wave To Replace Intel On Dow Jones Industrial Average, Ending Its 25-Year Run",https://www.benzinga.com/markets/equities/24/11/41699259/nvidia-rides-ai-wave-to-replace-intel-on-dow-jones-industrial-average-ending-its-25-year-run
2024-11-03,"Chipotle's Hiring, Musk's Predictions, And Nvidia's Human-Like AI: This Week In Artificial Intelligence",https://www.benzinga.com/news/24/11/41702528/chipotles-hiring-musks-predictions-and-nvidias-human-like-ai-this-week-in-artificial-intelligence
2024-11-03,"Consumer Tech News (Oct 28-Nov 1): Apple Starts Manufacturing Entry-Level iPhone Model, US Bans Investments In China's Semiconductor & AI, & More",https://www.benzinga.com/news/24/11/41702623/consumer-tech-news-oct-28-nov-1-apple-starts-manufacturing-entry-level-iphone-model-us-bans-investme
2024-11-04,Nvidia's Need For Speed: Jensen Huang Pushes SK Hynix For Earlier Memory Chip Delivery,https://www.benzinga.com/markets/equities/24/11/41705498/nvidias-need-for-speed-jensen-huang-pushes-sk-hynix-for-earlier-memory-chip-delivery
2024-11-04,"Nvidia Supplier TSMC To Double Advanced Chip Packaging Capacity As AI Demand From Microsoft, Amazon Soars",https://www.benzinga.com/markets/equities/24/11/41706702/nvidia-supplier-tsmc-to-double-advanced-chip-packaging-capacity-as-ai-demand-from-microsoft-amaz
2024-11-04,US Stocks Likely To Open In Green Amid Hints Of Tentativeness On Election Eve: Expert Says Brace For Volatility Ahead Of Fed's Rate Decision,https://www.benzinga.com/news/earnings/24/11/41709016/us-stocks-likely-to-open-in-green-amid-hints-of-tentativeness-on-election-eve-expert-says-brace-for
2024-11-04,End Of An Era - AI Propels Nvidia To Replace Struggling Intel In Dow Index,https://www.benzinga.com/news/24/11/41712053/end-of-an-era-ai-propels-nvidia-to-replace-struggling-intel-in-dow-index
2024-11-04,"Nvidia, Meta And A Ride-Hailing Giant On CNBC's 'Final Trades'",https://www.benzinga.com/trading-ideas/long-ideas/24/11/41713035/nvidia-meta-and-a-ride-hailing-giant-on-cnbcs-final-trades
2024-11-04,"Jim Cramer Reiterates 'Own Nvidia, Don't Trade It' But Says Jensen Huang's Chip Giant Should Go To Last Week's Levels",https://www.benzinga.com/analyst-ratings/analyst-color/24/11/41713371/jim-cramer-reiterates-own-nvidia-dont-trade-it-but-says-jensen-huangs-chip-giant-sh
2024-11-04,"Top 10 Trending Stocks On WallStreetBets As Of November 4, 2024 (Via Swaggy Stocks)",https://www.benzinga.com/trading-ideas/24/11/41714900/top-10-trending-stocks-on-wallstreetbets-as-of-november-4-2024-via-swaggy-stocks
2024-11-04,"Market Clubhouse Morning Memo - November 4th, 2024 (Trade Strategy For SPY, QQQ, AAPL, MSFT, NVDA, GOOGL, META And TSLA)",https://www.benzinga.com/markets/24/11/41715259/market-clubhouse-morning-memo-november-4th-2024-trade-strategy-for-spy-qqq-aapl-msft-nvda-googl-meta
2024-11-04,"EXCLUSIVE: Top 20 Most-Searched Tickers On Benzinga Pro In October 2024 — Where Do Tesla, Nvidia, Apple, DJT Stock Rank?",https://www.benzinga.com/top-stories/24/11/41718416/exclusive-top-20-most-searched-tickers-on-benzinga-pro-in-october-2024-where-do-tesla-nvidia-apple-d
2024-11-04,NVIDIA's Options: A Look at What the Big Money is Thinking,https://www.benzinga.com/insights/options/24/11/41719627/nvidias-options-a-look-at-what-the-big-money-is-thinking
2024-11-04,"Pay Attention To Warren Buffett Actions, Nvidia Celebration, Trump Trade Pulling Back",https://www.benzinga.com/general/market-summary/24/11/41719901/pay-attention-to-warren-buffett-actions-nvidia-celebration-trump-trade-pulling-back
2024-11-04,Tesla Vs. Nvidia Stock Performance Under Biden Might Reveal Truth About Elon Musk's Support For Trump,https://www.benzinga.com/markets/equities/24/11/41720723/tesla-vs-nvidia-stock-performance-under-biden-might-reveal-truth-about-elon-musks-support-for-tr
2024-11-04,10 Information Technology Stocks Whale Activity In Today's Session,https://www.benzinga.com/insights/options/24/11/41721172/10-information-technology-stocks-whale-activity-in-todays-session
2024-11-04,"Nvidia Joining Dow Jones Industrial Average: Where Tech Giant Ranks In The Index, Why Sherwin-Williams Addition Could Be More Important",https://www.benzinga.com/etfs/broad-u-s-equity-etfs/24/11/41724410/nvidia-joining-dow-jones-industrial-average-where-tech-giant-ranks-in-the-index-why-sh
2024-11-04,"Jim Cramer Keeps Recommending Tesla Because He Loves 'Space Stuff,' But He's Not Keen On Ford: 'I Can't Recommend The Stock'",https://www.benzinga.com/markets/equities/24/11/41734231/jim-cramer-keeps-recommending-tesla-because-he-loves-space-stuff-but-hes-not-keen-on-ford-i-cant
2024-11-05,"Taiwan Semiconductor Faces Rising Energy Costs, Potential Outages Threaten Production",https://www.benzinga.com/government/24/11/41739764/taiwan-semiconductor-faces-rising-energy-costs-potential-outages-threaten-production
2024-11-05,Dow Tumbles 250 Points As Investors Brace For High-Stakes Presidential Election: Greed Index Enters 'Fear' Zone,https://www.benzinga.com/news/earnings/24/11/41735761/dow-tumbles-250-points-as-investors-brace-for-high-stakes-presidential-election-greed-index-enters-
2024-11-05,Super Micro Computer Posts Q1 Earnings: Are Delisting Fears Here To Stay Or Can The Stock Rebound?,https://www.benzinga.com/trading-ideas/technicals/24/11/41745935/super-micro-computer-posts-q1-earnings-are-delisting-fears-here-to-stay-or-can-the-stock
2024-11-05,"Top 10 Trending Stocks On WallStreetBets As Of November 5, 2024 (Via Swaggy Stocks)",https://www.benzinga.com/trading-ideas/24/11/41746547/top-10-trending-stocks-on-wallstreetbets-as-of-november-5-2024-via-swaggy-stocks
2024-11-05,"Market Clubhouse Morning Memo - November 5th, 2024 (Trade Strategy For SPY, QQQ, AAPL, MSFT, NVDA, GOOGL, META And TSLA)",https://www.benzinga.com/markets/24/11/41748527/market-clubhouse-morning-memo-november-5th-2024-trade-strategy-for-spy-qqq-aapl-msft-nvda-googl-meta
2024-11-05,"Republican Win Likely To Lift Magnificent 7 Stocks, Democratic Sweep 'Better For Bonds,' Says WisdomTree",https://www.benzinga.com/analyst-ratings/analyst-color/24/11/41750191/republican-win-likely-to-lift-magnificent-7-stocks-democratic-sweep-better-for-bond
2024-11-05,Nvidia Takes Short-Lived Lead Over Apple In Valuation,https://www.benzinga.com/news/24/11/41751557/nvidia-takes-short-lived-lead-over-apple-in-valuation
2024-11-05,Here Is How Investors Can Capture Opportunities From The Election,https://www.benzinga.com/general/market-summary/24/11/41752762/here-is-how-investors-can-capture-opportunities-from-the-election
2024-11-05,10 Information Technology Stocks Whale Activity In Today's Session,https://www.benzinga.com/insights/options/24/11/41752886/10-information-technology-stocks-whale-activity-in-todays-session
2024-11-05,"Trump Win Could Hinder Tech, EV Sector Growth, 'Slow The Pace' Of AI Revolution: Analysts Lay Out 2024 Election Implications",https://www.benzinga.com/analyst-ratings/analyst-color/24/11/41755274/trump-win-could-hinder-tech-ev-sector-growth-slow-the-pace-of-ai-revolution-analyst
2024-11-05,Magnificent 7 Basket Notches Over 200% Gain Since Biden's Election: How Did Tech Giants Perform Under Trump?,https://www.benzinga.com/markets/equities/24/11/41756882/magnificent-7-basket-notches-over-200-gain-since-bidens-election-how-did-tech-giants-perform-und
2024-11-05,Nvidia Blows Past Apple To Become World's Most Valuable Company,https://www.benzinga.com/news/large-cap/24/11/41761849/nvidia-blows-past-apple-to-become-worlds-most-valuable-company
2024-11-05,Jim Cramer Blasts Super Micro Computer's Earnings: 'Better At Exonerating Itself Than Selling' Nvidia GPUs,https://www.benzinga.com/markets/equities/24/11/41763941/jim-cramer-blasts-super-micro-computers-earnings-better-at-exonerating-itself-than-selling-nvidi
2024-11-06,"$100 Invested In This Stock 5 Years Ago Would Be Worth $2,700 Today",https://www.benzinga.com/insights/news/24/11/41774136/100-invested-in-this-stock-5-years-ago-would-be-worth-2-700-today
2024-11-06,A Closer Look at NVIDIA's Options Market Dynamics,https://www.benzinga.com/insights/options/24/11/41775907/a-closer-look-at-nvidias-options-market-dynamics
2024-11-06,"Chip Stocks Like Nvidia, Broadcom, Taiwan Semi Gain After Trump Win - What's Going On?",https://www.benzinga.com/news/24/11/41780976/chip-stocks-like-nvidia-broadcom-taiwan-semi-gain-after-trump-win-whats-going-on
2024-11-06,10 Information Technology Stocks With Whale Alerts In Today's Session,https://www.benzinga.com/insights/options/24/11/41781809/10-information-technology-stocks-with-whale-alerts-in-todays-session
2024-11-06,"Robinhood Reports Record Overnight Trading Volume, 400 Million 2024 Election Contracts Traded",https://www.benzinga.com/fintech/24/11/41783293/robinhood-reports-record-overnight-trading-volume-400-million-2024-election-contracts-traded
2024-11-06,How Did S&P 500 Stock Sectors Perform During Trump's First Term? Could This Time Be Different?,https://www.benzinga.com/general/politics/24/11/41783357/how-did-s-p-500-sectors-perform-during-trumps-first-term-could-this-time-be-different
2024-11-06,Alibaba's AI Strategy: Massive Ad Spend to Dominate Crowded Market,https://www.benzinga.com/news/24/11/41785553/alibabas-ai-strategy-massive-ad-spend-to-dominate-crowded-market
2024-11-06,"Deplay Cash And Reduce Hedges, Short Term Opportunities At Hand, Prepare For Long Term Opportunties",https://www.benzinga.com/general/market-summary/24/11/41788497/deplay-cash-and-reduce-hedges-short-term-opportunities-at-hand-prepare-for-long-term-oppor
2024-11-07,"Tim Cook, Mark Zuckerberg, And Jeff Bezos Congratulate Trump: What's Next For The Tech Giants?",https://www.benzinga.com/news/24/11/41796344/tim-cook-mark-zuckerberg-and-jeff-bezos-congratulate-trump-whats-next-for-the-tech-giants
2024-11-07,Nvidia Partners With AI Startup Hugging Face To Supercharge Open Source Robotics,https://www.benzinga.com/news/24/11/41799600/nvidia-partners-with-ai-startup-hugging-face-to-supercharge-open-source-robotics
2024-11-07,"Microsoft Shows Room To Climb As Tesla, Nvidia, Amazon Near 52-Week Highs",https://www.benzinga.com/trading-ideas/long-ideas/24/11/41807202/microsoft-shows-room-to-climb-as-tesla-nvidia-amazon-near-52-week-highs
2024-11-07,"Market Clubhouse Morning Memo - November 7th, 2024 (Trade Strategy For SPY, QQQ, AAPL, MSFT, NVDA, GOOGL, META And TSLA)",https://www.benzinga.com/markets/24/11/41808598/market-clubhouse-morning-memo-november-7th-2024-trade-strategy-for-spy-qqq-aapl-msft-nvda-googl-meta
2024-11-07,"Top 10 Trending Stocks On WallStreetBets As Of November 7, 2024 (Via Swaggy Stocks)",https://www.benzinga.com/trading-ideas/24/11/41809070/top-10-trending-stocks-on-wallstreetbets-as-of-november-7-2024-via-swaggy-stocks
2024-11-07,How To Earn $500 A Month From Nvidia Stock After Trump Win,https://www.benzinga.com/trading-ideas/long-ideas/24/11/41809435/how-to-earn-500-a-month-from-nvidia-stock-after-trump-win
2024-11-07,10 Information Technology Stocks With Whale Alerts In Today's Session,https://www.benzinga.com/insights/options/24/11/41817613/10-information-technology-stocks-with-whale-alerts-in-todays-session
2024-11-07,Bonds And Fed Front And Center As Bonds Approach Bottom Support Zone After Trump Win,https://www.benzinga.com/general/market-summary/24/11/41819087/bonds-and-fed-front-and-center-as-bonds-approach-bottom-support-zone-after-trump-win
2024-11-07,"Wall Street Hits Record Highs After Powell's Speech, Lifts Magnificent 7 Stocks To $17 Trillion In Historic Trading",https://www.benzinga.com/news/large-cap/24/11/41826586/wall-street-closes-at-record-highs-after-reassurance-from-powell-magnificent-7-hit-17-trillion-tre
2024-11-07,"After OpenAI And Perplexity, AI Startup Anthropic May Secure Another Massive Investment — Amazon Reportedly Considers Major Funding",https://www.benzinga.com/news/24/11/41832230/after-openai-and-perplexity-ai-startup-anthropic-may-secure-another-massive-investment-amazon-report
2024-11-08,TSMC Shares Climb Despite Sluggish Growth In October: What's Going On?,https://www.benzinga.com/markets/equities/24/11/41838412/tsmc-shares-climb-despite-sluggish-growth-in-october-whats-going-on
2024-11-08,"Nvidia's Chinese Rivals Gear Up For Trump's Return With New Strategies - Overseas Expansion, Hire Foreign Talent And More",https://www.benzinga.com/tech/24/11/41841797/nvidias-chinese-rivals-gear-up-for-trumps-return-with-new-strategies-overseas-expansion-hire-foreign-talent-and-more
2024-11-08,"Top 10 Trending Stocks On WallStreetBets As Of November 8, 2024 (Via Swaggy Stocks)",https://www.benzinga.com/trading-ideas/24/11/41844888/top-10-trending-stocks-on-wallstreetbets-as-of-november-8-2024-via-swaggy-stocks
2024-11-08,Taiwan Semiconductor US Expansion Plans Unfazed by Trump Win: Report,https://www.benzinga.com/government/regulations/24/11/41845483/taiwan-semiconductor-us-expansion-plans-unfazed-by-trump-win-report
2024-11-08,In-Depth Analysis: NVIDIA Versus Competitors In Semiconductors &amp; Semiconductor Equipment Industry,https://www.benzinga.com/insights/news/24/11/41846085/in-depth-analysis-nvidia-versus-competitors-in-semiconductors-amp-semiconductor-equipment-industry
2024-11-08,Nvidia Taps Former NASA Astronaut To Enhance Board,https://www.benzinga.com/24/11/41851308/nvidia-adds-former-nasa-leader-to-board-boosting-strategic-expertise
2024-11-08,10 Information Technology Stocks Whale Activity In Today's Session,https://www.benzinga.com/insights/options/24/11/41852192/10-information-technology-stocks-whale-activity-in-todays-session
2024-11-08,"Scale In On Trump Hopium Dips – Watch Nvidia As An Indicator, Big China Stimulus",https://www.benzinga.com/general/politics/24/11/41857037/scale-in-on-trump-hopium-dips-watch-nvidia-as-an-indicator-big-china-stimulus
2024-11-09,"Benzinga Bulls And Bears: Nvidia, Rivian, Plug Power, Palantir — And Dogecoin's 'Beautiful Bounce'",https://www.benzinga.com/trading-ideas/long-ideas/24/11/41865740/benzinga-bulls-and-bears-nvidia-rivian-plug-power-palantir-and-dogecoins-beautiful-bounce
2024-11-09,Qualcomm Delivers Upbeat Results That Show Its Diversification Efforts Are Working,https://www.benzinga.com/24/11/41865771/qualcomm-delivers-upbeat-results-that-show-its-diversification-efforts-are-working
2024-11-10,"Tesla Remains Core For Gary Black Despite Price Cuts, Earnings Drop — Nvidia, Google, Eli Lilly Among Top Performers In Tech Bull's Portfolio",https://www.benzinga.com/analyst-ratings/analyst-color/24/11/41870590/tesla-remains-core-for-gary-black-despite-price-cuts-earnings-drop-nvidia-google-eli-lilly-among-top-performers-in-tech-bulls-portfolio
2024-11-11,"Nvidia Supplier TSMC Faces Regulatory Hurdles In Manufacturing 2-Nanometer Chips Abroad, Minister Says 'Core Technology Will Stay In Taiwan'",https://www.benzinga.com/news/global/24/11/41871161/nvidia-supplier-tsmc-faces-regulatory-hurdles-in-manufacturing-2-nanometer-chips-abroad-minister-says-core-technology-will-stay-in-taiwan
2024-11-11,"As Nvidia Replaces Intel On S&P Dow Jones Indices, Here's A Comparison Of How Both Stocks Performed Over The Past Year",https://www.benzinga.com/general/market-summary/24/11/41874537/nvidia-replaces-intel-on-dow-fineprint-of-what-led-to-the-change-along-with-stock-performance
2024-11-11,"Morgan Stanley Maintains Overweight on NVIDIA, Raises Price Target to $160",https://www.benzinga.com/news/24/11/41874716/morgan-stanley-maintains-overweight-on-nvidia-raises-price-target-to-160
2024-11-11,"Piper Sandler Maintains Overweight on NVIDIA, Raises Price Target to $175",https://www.benzinga.com/news/24/11/41874997/piper-sandler-maintains-overweight-on-nvidia-raises-price-target-to-175
2024-11-11,Super Micro Computer Shares Are Down By Over 4% In Pre-Market: What's Going On?,https://www.benzinga.com/markets/equities/24/11/41875894/super-micro-computer-shares-are-down-by-over-4-in-pre-market-whats-going-on
2024-11-11,ASML's IT Outage Affected Chipmaking Operations Worldwide,https://www.benzinga.com/government/regulations/24/11/41876507/asmls-it-outage-affected-chipmaking-operations-worldwide
2024-11-11,Nvidia To Rally More Than 18%? Here Are 10 Top Analyst Forecasts For Monday,https://www.benzinga.com/24/11/41876752/nvidia-to-rally-more-than-18-here-are-10-top-analyst-forecasts-for-monday
2024-11-11,"Top 10 Trending Stocks On WallStreetBets As Of November 11, 2024 (Via Swaggy Stocks)",https://www.benzinga.com/trading-ideas/24/11/41879288/top-10-trending-stocks-on-wallstreetbets-as-of-november-11-2024-via-swaggy-stocks
2024-11-11,NVIDIA Unusual Options Activity,https://www.benzinga.com/insights/options/24/11/41879623/nvidia-unusual-options-activity
2024-11-11,"Market Clubhouse Morning Memo - November 11th, 2024 (Trade Strategy For SPY, QQQ, AAPL, MSFT, NVDA, GOOGL, META And TSLA)",https://www.benzinga.com/trading-ideas/24/11/41879709/market-clubhouse-morning-memo-november-11th-2024-trade-strategy-for-spy-qqq-aapl-msft-nvda-googl-me
2024-11-11,Market Analysis: NVIDIA And Competitors In Semiconductors &amp; Semiconductor Equipment Industry,https://www.benzinga.com/insights/news/24/11/41879938/market-analysis-nvidia-and-competitors-in-semiconductors-amp-semiconductor-equipment-industry
2024-11-11,"Money Flows Out Of Gold Into Bitcoin, Next Bitcoin Stop $100,000, Aggressive Buying In Tesla",https://www.benzinga.com/markets/cryptocurrency/24/11/41883612/money-flows-out-of-gold-into-bitcoin-next-bitcoin-stop-100-000-aggressive-buying-in-tesla
2024-11-11,Nvidia's Blackwell Chip Revenue Could Hit $6 Billion Next Quarter: Analyst,https://www.benzinga.com/analyst-ratings/analyst-color/24/11/41883803/nvidias-blackwell-chip-revenue-could-hit-6-billion-next-quarter-analyst
2024-11-11,The Analyst Verdict: NVIDIA In The Eyes Of 33 Experts,https://www.benzinga.com/insights/analyst-ratings/24/11/41883866/the-analyst-verdict-nvidia-in-the-eyes-of-33-experts
2024-11-11,Why Are Chip Stocks Trading Lower On Monday?,https://www.benzinga.com/24/11/41884192/nvidia-intel-broadcom-stocks-drop-as-us-restricts-advanced-chip-sales-to-china
2024-11-11,"Melius Research Maintains Buy on NVIDIA, Raises Price Target to $185",https://www.benzinga.com/news/24/11/41884250/melius-research-maintains-buy-on-nvidia-raises-price-target-to-185
2024-11-11,10 Information Technology Stocks With Whale Alerts In Today's Session,https://www.benzinga.com/insights/options/24/11/41884491/10-information-technology-stocks-with-whale-alerts-in-todays-session
2024-11-11,"UBS Maintains Buy on NVIDIA, Raises Price Target to $185",https://www.benzinga.com/news/24/11/41886231/ubs-maintains-buy-on-nvidia-raises-price-target-to-185
2024-11-11,Nvidia CEO Jensen Huang Doesn't Wear A Watch After A Gardner Taught Him The Secret Of Time,https://www.benzinga.com/24/11/41888032/nvidia-ceo-jensen-huang-said-nvidia-has-no-long-term-strategy-how-this-philosophy-is-similar-to-his-reason-to-not-wear-a-watch
2024-11-12,"Ross Gerber, Cathie Wood Or Gary Black? Whose Funds Stack Up Against S&P 500's Gains In 2024?",https://www.benzinga.com/news/global/24/11/41891628/ross-gerber-cathie-wood-or-gary-black-whose-funds-stack-up-against-sp-500s-gains-in-2024
2024-11-12,"Redburn Atlantic Initiates Coverage On NVIDIA with Buy Rating, Announces Price Target of $178",https://www.benzinga.com/news/24/11/41894464/redburn-atlantic-initiates-coverage-on-nvidia-with-buy-rating-announces-price-target-of-178
2024-11-12,Amazon Set To Introduce New AI Chips In December To Rival Jensen Huang's AI Stalwart: 'We Want To Be Absolutely The Best Place To Run Nvidia',https://www.benzinga.com/tech/24/11/41895759/amazon-set-to-introduce-new-ai-chips-in-december-to-rival-jensen-huangs-ai-stalwart-we-want-to-be-absolutely-the-best-place-to-run-nvidia
2024-11-12,"Nancy Pelosi's Stock Picks Broadcom And Nvidia Among Key AI Stocks Poised For Chip Boom, Says Analyst",https://www.benzinga.com/analyst-ratings/analyst-color/24/11/41896181/nancy-pelosis-stock-pick-broadcom-and-nvidia-among-other-key-ai-stock-poised-for-chip-boom-says-analyst
2024-11-12,"Mizuho Maintains Outperform on NVIDIA, Raises Price Target to $165",https://www.benzinga.com/news/24/11/41896292/mizuho-maintains-outperform-on-nvidia-raises-price-target-to-165
