date,news_content,url
2024-11-20,"Stock Market Today: Dow heads for fifth day of losses, Nasdaq also drops ahead of Nvidia earnings. Follow all the latest U.S. market action for Wednesday here.",https://www.marketwatch.com/livecoverage/stock-market-today-dow-futures-climb-as-traders-await-nvidia-earnings&ved=2ahUKEwiS74DE3-uJAxWJlokEHeYdHGoQxfQBegQIBBAC&usg=AOvVaw3HSnYX5uPxL-9R_FkQxsdp
2024-11-20,"Stanley Black & Decker updates targets, plus Nvidia and Palo Alto earnings on deck. Every weekday, the CNBC Investing Club with Jim Cramer releases the Homestretch — an actionable afternoon update, just in time for the last hour of trading...",https://www.cnbc.com/2024/11/20/stanley-black-decker-updates-targets-nvidia-and-palo-alto-earnings-.html&ved=2ahUKEwiS74DE3-uJAxWJlokEHeYdHGoQxfQBegQICRAC&usg=AOvVaw3H46vU56vOJ353kkLOeQu0
2024-11-20,"Stocks fall as Nvidia dips before earnings report: Live updates. Stocks fell Wednesday, with Nvidia shares sliding 2% ahead of its highly-anticipated earnings report. Investors also assessed disappointing results from...",https://www.cnbc.com/2024/11/19/stock-market-today-live-updates.html&ved=2ahUKEwiS74DE3-uJAxWJlokEHeYdHGoQxfQBegQIBxAC&usg=AOvVaw2E7RQ1GYa0tULSvPDuaw4_
2024-11-20,"Stock Market News Today: Dow, Nasdaq Slip; Investors Await Nvidia Earnings — Live Updates. All eyes are on Nvidia's earnings report, which comes today after the market closes. Live updates on stocks, bonds and markets, including the Dow Jones...",https://www.wsj.com/livecoverage/nvidia-earnings-stock-market-today-dow-sp500-nasdaq-live-11-20-2024&ved=2ahUKEwiS74DE3-uJAxWJlokEHeYdHGoQxfQBegQIBhAC&usg=AOvVaw1J6EP5rAEEHGBTgW8q5jeF
2024-11-20,"Nvidia On Deck. Will Report Spark Rally? (Live Coverage). AI chipmaker Nvidia will report its fiscal Q3 results late Wednesday, but stock watchers are more interested in its guidance for Q4.",https://www.investors.com/news/technology/nvidia-stock-nvda-fiscal-q3-2025-earnings/&ved=2ahUKEwiS74DE3-uJAxWJlokEHeYdHGoQxfQBegQIAxAC&usg=AOvVaw2d71bI0AiONgyhK4focjR-
2024-11-20,"Dow Jones Falls As Nvidia Earnings, CEO Huang Remarks Loom; AI Stock Soars, Retail Stock Heads For Second Biggest Day (Live Coverage). Dow Jones lagged as investors await Nvidia earnings on the stock market today. Palo Alto Networks and Snowflake also are due to report.",https://www.investors.com/market-trend/stock-market-today/dow-jones-sp500-nasdaq-nvidia-earnings-nvda-ai-stock/&ved=2ahUKEwiS74DE3-uJAxWJlokEHeYdHGoQxfQBegQICBAC&usg=AOvVaw2Nac0ngbTquHLdBxv3SZ-T
2024-11-20,"Nvidia may see huge stock price swing after earnings. Nvidia's third-quarter earnings will be reported after the closing bell on Wednesday, and everyone will be focusing on its demand outlook for the end of the...",https://www.thestreet.com/investing/analysts-weigh-in-on-nvidia-earnings-amid-bets-on-big-stock-price-swing&ved=2ahUKEwiS74DE3-uJAxWJlokEHeYdHGoQxfQBegQIARAC&usg=AOvVaw2_WdA6Ct8SluydC8JSIQ-I
2024-11-20,"Bitcoin Boosts MicroStrategy (MSTR) to Higher Trading Volume Than Tesla and Nvidia. Today, MicroStrategy (MSTR) surpassed a $100 billion market cap to become the 93rd largest publicly-traded company in the U.S.. At the time of writing,...",https://bitcoinmagazine.com/markets/bitcoin-boosts-microstrategy-mstr-to-higher-trading-volume-than-tesla-and-nvidia&ved=2ahUKEwiS74DE3-uJAxWJlokEHeYdHGoQxfQBegQIAhAC&usg=AOvVaw1FpuCsfl5lcQxzaA6JLQID
2024-11-20,"Nvidia earnings are on deck. Here’s what Wall Street is watching for. Analysts expect the chipmaker to post earnings of 75 cents per share on about $33.16 billion in revenue, or more than 80% revenue growth compared to a year...",https://www.cnbc.com/2024/11/20/nvidia-earnings-are-on-deck-heres-what-wall-street-is-watching-for.html&ved=2ahUKEwiS74DE3-uJAxWJlokEHeYdHGoQxfQBegQIBRAC&usg=AOvVaw0_0S9rz1oKtCqhcqrqUTlX
2024-11-20,Nvidia's Blackwell AI GPU overheating issues are seemingly overhyped — semiconductor analysts reveal cooling issues have been mostly addressed. Analysis report that Nvidia's Blackwell overheating problems are over-exaggerated. Overheating issues have been purportedly largely addressed already.,https://www.tomshardware.com/pc-components/gpus/nvidias-blackwell-ai-gpu-overheating-issues-are-seemingly-overhyped-semiconductor-analysts-reveal-cooling-issues-have-been-mostly-addressed&ved=2ahUKEwiS74DE3-uJAxWJlokEHeYdHGoQxfQBegQIABAC&usg=AOvVaw2QS7ELOlrwvd6FZxq-LkBE
2021-02-18,"GeForce Is Made for Gaming, CMP Is Made to Mine. ",https://news.google.com/read/CBMiVEFVX3lxTE5tdTEtczROTHBIU1NaZ3VhT1hBd0RhWThHRkRUdHJmWk5KVzRpcHptY20yclRnR3pXcldxcm1QTmlyUFhrcV9jRTI4YmU4NUVmcV8xNA?hl=en-US&gl=US&ceid=US%3Aen
2024-03-18,NVIDIA Blackwell Platform Arrives to Power a New Era of Computing. ,https://news.google.com/read/CBMiogFBVV95cUxOczF5bzhxRFgzM1lwaC1reFBBdV81VzFpM1JocmpWRVBFMlM2MHZRdGhCVEk5YzBkRXR4NTlWSk5WN29qVXowOWtzeG5lX01ma1RpU2tRU3QzMGFUQmpLelBLMEtlSEc0X3VPU3VneGRVclhxSHRZc2lYLXpQbjJja2kyTVZWZDJ0X2RQUVVPblZLbFMxX2U2RGNGNmZMT3RMRXc?hl=en-US&gl=US&ceid=US%3Aen
2023-11-13,"NVIDIA Supercharges Hopper, the World’s Leading AI Computing Platform. ",https://news.google.com/read/CBMipAFBVV95cUxPendCQ3B1THR2ejgxVFBiT2NfZ3NkeVdOTVlBeVRlWEdDVmloeXE3MW5RVWdIeTFjOW1TMExzSnRVTE1YazBOMmVYZ2hIVEYwQktRZzdaZXVkYXczLVZEX1B1YkJfYW9SYm11RHUxLVdRVXEtdUF1VF9aR3ZmSTd0cEhQVnFzZTlkZzlKSEFnZXg1TklYNkUwbDJvQWhiMEtqTi1NWQ?hl=en-US&gl=US&ceid=US%3Aen
2024-11-07,Welcome to GeForce NOW Performance: Priority Members Get Instant Upgrade. ,https://news.google.com/read/CBMif0FVX3lxTE02cGFrNl9qX0NtWU9YQUNLYUpoV3oxR1BjRUVKTmVXdElTZGVFeE12d2N6N2hzNExnZGRQM3Zsdk93OFNUX2ZpNUx3N3Y1VkdSdlVsck5uQW5aRFRIZUNfdVE2UjdrQ2FiWkFZbmdYbU9SVG9LNTBmQTUyY0EyNEE?hl=en-US&gl=US&ceid=US%3Aen
2024-11-12,NVIDIA App Officially Released: Download The Essential Companion For PC Gamers & Creators. ,https://news.google.com/read/CBMigAFBVV95cUxOaFREOWJ6Tm44UTZDd1VmTmJ5U0p4MXVJXzQ4bEY1LWR1MnQxalBWeUZyV1pQeFJxM3R3UkJialdYZzJUdHNpdXRpQmxEUElUXzEzZnBWaS1jR25IYnpvYmIyc0djU0NPQjZXdUF3UVJZa1o5Z0lSdnhtWlRQUjBOWA?hl=en-US&gl=US&ceid=US%3Aen
2022-10-14,Unlaunching The 12GB 4080. ,https://news.google.com/read/CBMibkFVX3lxTE5VcDVjQXVrRDBmbXRtZkd2Yl9rWHl2eTJ5cGFfQ3FFYmJwaVp6cTVJMXBaemdHdmZKUkFOT25wR3NheXBEaVpkQlhpdWlHLUc2VFgyU0t3OC03ZW5DanhqRHJtTnF3WVhrbDRsZ3FB?hl=en-US&gl=US&ceid=US%3Aen
2024-02-21,NVIDIA Announces Financial Results for Fourth Quarter and Fiscal 2024. ,https://news.google.com/read/CBMipwFBVV95cUxOUFBYRExUUVJUbDhOSkR6WVVJT2RXZTd0MmszWm9hLTNYR0xlRmw1STlrMnFwMUlWNWdjZzRfWTRRZEtjOXk2WnRNZU9DU080elVUdzlWLWxTT1hvQVplNnVvX1phWUgzWldfc2xoSmEyZmdHakg1X240RzNrWEJ4MkN4eDBmVGZVTmN0UThBT0JZUGhHaG4yNzgzU3RuWmFCd280RzlZTQ?hl=en-US&gl=US&ceid=US%3Aen
2024-01-08,GeForce RTX 40 SUPER Series: New Heroes Debut in the Gaming and Creating Universe With AI as Their Superpower. ,https://news.google.com/read/CBMib0FVX3lxTE85WE9wMnBHNFViVi1TNXc0Sk9zam1xX1FlS3kwekFlVElLNkNZLWNpQlE0QUktOS1kVVNoT0twcU50VDU2Y2Nra2ZqRFB6ajg2ZFI0cVFwaXEzYU0yZERPZ21nVDF2anJSdzRJUnZfVQ?hl=en-US&gl=US&ceid=US%3Aen
2024-07-09,Widescreen Wonder: Las Vegas Sphere Delivers Dazzling Displays. ,https://news.google.com/read/CBMiW0FVX3lxTE9TSEN4S2xES2p6MEE4VzNnUjlySzR4WXoxVmwxdEhOOFVJUjBBdkdkZzliVWgwdl9FRVRJRWRiMmNjU1ZRM2puVjRqS1FWT1EtcDY5Yk5jYVlPWXc?hl=en-US&gl=US&ceid=US%3Aen
2024-03-18,Build a Custom LLM with ChatRTX. ,https://news.google.com/read/CBMiW0FVX3lxTE1meWJ4dGpuTjBBNmlXWXd5anZ1ckdibE81VDU2WWlFTnhGZmlOb0xfXzNGRmpXVS1LbHdfUXdvcDBtTkZJbTlhNjZzWDhHY0p0TmpQZFlkZk9iM1U?hl=en-US&gl=US&ceid=US%3Aen
2024-08-28,NVIDIA Announces Financial Results for Second Quarter Fiscal 2025. ,https://news.google.com/read/CBMiogFBVV95cUxPX3JXMExqclZfcUlCNmxSbWNTdE5kZnBDdTZKOXhId0JsWERnVWFLVkVGcUtncGktcGZhN0tORU92cTdpejZWYTNKZVRCeF9PTkowMWZSdEZxdnJ0enROLXo3OHhvX3VNbWNQblBVVl85T3RHdER2S0paU2I5VDRoSExpa3FEbmFWNHV0NjRsZXh4ZlpuMEY0ajBJa2xnUVVFcUE?hl=en-US&gl=US&ceid=US%3Aen
2021-08-10,What Is the Metaverse?. ,https://news.google.com/read/CBMiYkFVX3lxTFBCaFU1ZTV0REhfRTFkTHdENUM3cUhkaGJoQnFJclNWSnVNb0JjQzV2MGNHc3FDY2QyV05vbzFsa1lJVjUxdWxEaFNGSHY4dDJIR2JkUzZuQ01uLVJ0MkhmSFdn?hl=en-US&gl=US&ceid=US%3Aen
2021-05-26,NVIDIA Announces Financial Results for First Quarter Fiscal 2022. ,https://news.google.com/read/CBMioAFBVV95cUxOOUtKb0pmZzZBUHpkRm5GS0NoNVNvWXJ1RFR2blRXRXlHelVVUHMtd3VSdzdHa1hOR05EQVQ0WWt3bkt2YV96Yl9jR0hRYklYM1ZhRERGeXJaYzRSV2ZxUGVzYzdDd1RPNlBfNGx5NWhIRnIwSTUyd2FkeVJ5c2VjeFE5ckxqWVM0Zmw2Q1R6MERVRC1BeFdpWDRKZ19rSUN0?hl=en-US&gl=US&ceid=US%3Aen
2023-01-03,NVIDIA Brings RTX 4080 to GeForce NOW. ,https://news.google.com/read/CBMifEFVX3lxTE5IQjB4d05JYlg1Q1Q2eGN6V1RmXzNHaHBYcllwV3NxeHJpSTFYbXU5ZnlEUXJuZU5neVJvY1JYRzBpZkMwNjBJZ2ZVV2F3R2x5T0RLdlNwcVEzWEFVNlkwNXdhR3l0WnlDajl0enF6ekplTGstV0tRUHVPUkk?hl=en-US&gl=US&ceid=US%3Aen
2024-06-02,NVIDIA Brings AI Assistants to Life With GeForce RTX AI PCs. ,https://news.google.com/read/CBMimgFBVV95cUxPbHQ4U1NrWjJLR0VCWkF5NG8yLWd5dDRSaVZTOFJFbFc4bjBxSUdXaUlWUF9qM2U5dkhqNGtsTGV4SmlwTFFaLTNpUUZxdHVkcUltZHJwdnVSLUFCdzhlN3FJVmNZNjVHaTg5cnVsaXVrUXo4VmtNR0drQTltS1ctaXFvMC1FR1hFY1JrTVJMVFlkODlxaUZuV1dR?hl=en-US&gl=US&ceid=US%3Aen
2024-01-24,High Can See Clearly Now: AI-Powered NVIDIA RTX Video HDR Transforms Standard Video Into Stunning High Dynamic Range. ,https://news.google.com/read/CBMickFVX3lxTE53UjNpOVJZZFlYamxhX3JjR1RvUktmVjJPTnE3OXpXeWZHWEJMdEE4NWFWRGxVcWlURGxVZlJMN21TR3B6ZndBZVB1RkQ3YmlrZHhHSlY0ZWhMUkZYX2Nld2Z2UXNsMW15MFZqWTdNLTZwZw?hl=en-US&gl=US&ceid=US%3Aen
2024-03-18,NVIDIA Launches Generative AI Microservices for Developers to Create and Deploy Generative AI Copilots Across NVIDIA CUDA GPU Installed Base. ,https://news.google.com/read/CBMigwFBVV95cUxOTWpXN2ZOSkctMi1DOWduRVVJN0RVb2tBaFU1bkNGYTkzNUlncjZiOVY2YlVkZnBLVHhiOE1SM1FIX1ZLTVgydnJadjJULWxpdVBndXl6a202MHpJd1h4ZkF0OWdoU2V0ZWRBWlBzX1I5djZOMWtlUzFmN0JaX0NPNjViTQ?hl=en-US&gl=US&ceid=US%3Aen
2023-03-21,"NVIDIA, ASML, TSMC and Synopsys Set Foundation for Next-Generation Chip Manufacturing. ",https://news.google.com/read/CBMiugFBVV95cUxQcnF1SlZ6eEQ1UFRka3pONWZRVWhabm9Ha1JWV05ZelBubXQ2SDh5STlfOGx0Yy1HSTRFVUthTktiRk96YTJOYTg4YW81aU5KZU5FUXY0RTRCUHRwa0JLU29TUU9rZ0k2NHFscFZ1ajF2TFM1a2llVVc2RFkyb2lub2RpSllvX3d0SVFfWmZIU1h6Q2pDYlpiNEp5ZTcyeThYMmF0dDJNaUlNZ0lGX09BOEJtZGpwNGowSWc?hl=en-US&gl=US&ceid=US%3Aen
2024-02-22,Test Drive The New NVIDIA App Beta: The Essential Companion For PC Gamers & Creators. ,https://news.google.com/read/CBMidkFVX3lxTFBYNFhVNjJpSVpPZUx2V3VLM05TWDdEa2hpclhiY2p4bVpZcndfMmpwdEJ3MkVORWxjTjlVTHBSLWRWRGE5TFk2MEZzY1Rzbjl3Y1RZNzZMOUNBRmt1ejgwUFZCVzFJTlFVOVE1amdpVDlscUYzSWc?hl=en-US&gl=US&ceid=US%3Aen
2023-05-24,NVIDIA Announces Financial Results for First Quarter Fiscal 2024. ,https://news.google.com/read/CBMioAFBVV95cUxNNkV3eDkwaFdBWFJDT2xiTVZGNE1pNFNyUndKbHkxOWlZU1VLdnZyT3FEQ3BzRk1VR1VDZmI0TDJIQ1h4UkN1TnZBSWRfWTMtMG5uY0lZOHdLaWJWb05Yc0VMNGdQRGhpbllDWXYyR1YwODVyQW9TV1ZXRkpyaFV1ck50RkVKdnE1RlFRd28yX1J4UklqcUh4aFdsRE12R0NJ?hl=en-US&gl=US&ceid=US%3Aen
2024-10-28,"NVIDIA Ethernet Networking Accelerates World’s Largest AI Supercomputer, Built by xAI. ",https://news.google.com/read/CBMihAFBVV95cUxPNUFTOXJoX2c4NS1Uc2xpX1NEdUROTGJCVjJRV3ZPOHNXUlVmQ2oxQzNGU2ZaVlg5SFZDWTdUZE9WZm9SUERBUUNmZ3plYjFTaWhTRkh2cWVjTElaeU1pQ1R1cWg5SzJjbjA1U0pVNEN5djlRaTQ0WUhjakNXYXg0Z3RISTA?hl=en-US&gl=US&ceid=US%3Aen
2023-08-22,"NVIDIA DLSS 3.5: Enhancing Ray Tracing With AI; Coming This Fall To Alan Wake 2, Cyberpunk 2077: Phantom Liberty, Portal with RTX & More. ",https://news.google.com/read/CBMigwFBVV95cUxQMy1NNHh5LV9zSTBpWDlFMTdCN1FMMFZfM2NfRlhTaWpjNkh6c09RT1BwMm03N3dHRDVZRjNKNm54b2lPSmdUYTRkNVozT00zWWJFRnAwZWV0U2dOQ3JVVnE5NURnT2FkN3NEUjdpR3RHbE5sVlZnaXJUQzJwZVl6TjQtMA?hl=en-US&gl=US&ceid=US%3Aen
2021-03-30,GeForce RTX 30 Series Performance Accelerates With Resizable BAR Support. ,https://news.google.com/read/CBMijwFBVV95cUxQbTFvMnBGeE9Hc3V2NHNQSTI5QmNRTTlaMHJJdWM5ZUxfVW5OdmtoMExJMi02V3k0QzBVZjNqenpfTndxTzFyM3pkRjFmRVVac2xDbU1WWTlYNXhib0VyZjgtVjU4SXcyTG5MdWlBc2VZcF9tVVZocTQ5Q1RhRXMwQ0FHWkRoOTVPam9sZGtlVQ?hl=en-US&gl=US&ceid=US%3Aen
2024-06-02,"‘Accelerate Everything,’ NVIDIA CEO Says Ahead of COMPUTEX. ",https://news.google.com/read/CBMiaEFVX3lxTFBNVE51RVY5ZjhXQldMeV9lNF8tYnRhdUdqbl9Nd2RxenBqLWN0cS1PRFBTYjFCaXVQQ1NhTk9jS2pzWDFhdm9TWnpDd2tyZEp5cUJGXzE5LVdKblA3Y1RLYTRsV0VCRVRE?hl=en-US&gl=US&ceid=US%3Aen
2023-05-28,MediaTek Partners With NVIDIA to Transform Automobiles With AI and Accelerated Computing. ,https://news.google.com/read/CBMidkFVX3lxTFBBcUlDQlczcHczWkR5ajJDN3pTNUdDNmQ2M0QxUnVnUFhmQVNwbGRGdUdfM0E0ZXRucHBERzBEeUQwSFNjZmVKRzRfd05TdzZMcTJYS1hFNmxuYmM2OHpOTFVlTnY2OC1PMmN2N1hKYUlPeGRNN0E?hl=en-US&gl=US&ceid=US%3Aen
2024-02-21,Shining Brighter Together: Google’s Gemma Optimized to Run on NVIDIA GPUs. ,https://news.google.com/read/CBMiaEFVX3lxTE5aYkxKQUw2YlZFa3ZYbHFKY0R0WFlRTU93SHFqZDJiWGlZblBpYVBTTHI3N2xsNDA1Tkl6MFZEY1VRSGZFMUFNR2YtVUVJWHc0RC0wRGlqelVoZnQzMDRqZVVUaHZGZFFi?hl=en-US&gl=US&ceid=US%3Aen
2023-02-21,Microsoft and NVIDIA Announce Expansive New Gaming Deal. ,https://news.google.com/read/CBMilAFBVV95cUxPV0d0RDJFVXdYcnptMy1uQ3JpZVRPbUQ1WVNkUExpTzVqcWhEZnMwVTBYWEh4R0tyRW5lTDNENWZBLVBkcXZfWkNnTUdIRmFpeXA0blNiM2xhMDBIUG9Nb216OTIxYUJzQ2VLR0ZGdnExOGNxdUZ1dVdmLTY2N0MycjhBREhmNm1hbjZPVnlYMHoxNnNu?hl=en-US&gl=US&ceid=US%3Aen
2023-06-22,"GeForce RTX 4060 Launching June 29th, Starting At $299. ",https://news.google.com/read/CBMigwFBVV95cUxOSWRRdGk4eU1Jc1pJVWx0WVZJeHpDZEtON29taTJZdG9objlRYWdlXzR4d1l1MmFuQjB4UE5kQ1l0VVFpZlRlbHlBdVZZU2dEUlJTX2JoUkpZanE1RjBZS0hxOUZHYk1fOUNmQkgtX2R4dUk2YlYwWXp2VmkwVFNUQnd4UQ?hl=en-US&gl=US&ceid=US%3Aen
2024-06-02,NVIDIA App Beta Update Adds AV1 Recording & One-Click Performance Tuning. ,https://news.google.com/read/CBMikgFBVV95cUxPMndvSU4zOXBjbjJ2ckk1RDF0cDZ0M1FlZS1BbmhTbFQ3eWVqZXloaDRiNjVET3ByckVxcTJpcXl2WDVBYjA3QVR2MFd3Z2g0ZFJQdDFVT3B6ejhlM0NyZzFfaWtiYVBzWm56YWhBNWMzNGFXYldsbEh4WUlzdnJTU05FVW9odWhzTlVqbGJuZVpMZw?hl=en-US&gl=US&ceid=US%3Aen
2023-01-03,"GeForce RTX 4070 Ti Brings NVIDIA Ada Lovelace Architecture To $799, Faster Than The RTX 3090 Ti At Almost Half The Power. ",https://news.google.com/read/CBMib0FVX3lxTE9qaEVfV1pqTHpqNmdCaVFaMFB5c041MFNXUk1nREV6N1gxaEdUSzl0MDM4RzJCb2JnVFlxRmhPMHlzU3ZUZkc5TndCUkN2djJtbUZMNjgtTW9yMnRPbmRneDg2QkJyOVlyT0R5WUNXSQ?hl=en-US&gl=US&ceid=US%3Aen
2024-05-22,NVIDIA Announces Financial Results for First Quarter Fiscal 2025. ,https://news.google.com/read/CBMioAFBVV95cUxQclk1bTBCcnZoaEZxdHRRSmticG9Kd0NhTkdzWGliX1Z0NEZYRTVlVzNVVEhfNzh2bGUyc0N6Zkx6U1djMmQ5TUR5eGFMWnNhNjhhSUQ3N0NCcjRNckJhVk1laGJCZURIUk1lY0xITFdicFJoTDNIcWU5ZTY3LUFmbmJHMnlvbHFKbVBJUzgyaS1SUGE0NGdqajJuQjA4N3VO?hl=en-US&gl=US&ceid=US%3Aen
2023-08-08,NVIDIA Unveils Next-Generation GH200 Grace Hopper Superchip Platform for Era of Accelerated Computing and Generative AI. ,https://news.google.com/read/CBMiiAFBVV95cUxQMzE4ZWlYbm5sdWN5dGxGRExPbVBnelR0dHVLN2o2MlJvcTc5RU9BbnRDdGtzb2d5T2lIaWgyN05vamY5UTEwa0pyd1ZEam1WX3I1SkdjMWRDbnJGQ204NnFVeWxIOGJpRWhXdVg5VDE0eXlOUnJCUWpWeTFodnhLR3VmSGJKeWFs?hl=en-US&gl=US&ceid=US%3Aen
2024-01-08,"NVIDIA Brings Generative AI to Millions, With Tensor Core GPUs, LLMs, Tools for RTX PCs and Workstations. ",https://news.google.com/read/CBMifkFVX3lxTFBmNDdBVzdmY3V4czAybVBtMFlfTWg5aEduSHN6dUFaREROY3pxWlF4ek0tQTVuZ2hPSXE2MEU4dGVMZnpkWHY1R2gyNnNmTVpDdlJjOWRHY2I1eVdycVdoRnR3cmZyTkNQSXVrQ1NKenZkRmhKTVVWNTFzZm83QQ?hl=en-US&gl=US&ceid=US%3Aen
2024-01-08,"GeForce RTX 40 SUPER Series Graphics Cards Launching This January, For Supercharged Gaming & Creating, With Super-Fast AI. ",https://news.google.com/read/CBMiigFBVV95cUxPajkwQjcxejVCa0ticVBEWVR1blZ4VkpUbUw3cVkzbzdBTVhQWHRyMEx4Z3dUZ3kzV243YUxXeWk0b0FyWTlhU0xLSlpXX3g0QmhVaUs1SF9rcXZIVzVPOERxVUoxdXV2SWZBb2RZRVRTUVM2LXBiVXFucFBCRGJkb3VuWXhpUWhwbkE?hl=en-US&gl=US&ceid=US%3Aen
2024-07-29,NVIDIA Accelerates Humanoid Robotics Development. ,https://news.google.com/read/CBMimAFBVV95cUxQMDZkaGRFQ3FTVUZHNjIxTTFKVEoxallOeW5kNG5QQ01LVVpEN3ZMem5NbGhubDdjenRicFg4R2ZDUUljRmIyV2E0Q3ZzLVNLVDNaVVBsQno0bDF0dmdmR1U3ekxoQVhuZF8zSGdma3d4QWhJVUQxc0dGb2k4YmtlNmNuOVNmSnUxcmlDWUE1YzY0eGtOYnBQVw?hl=en-US&gl=US&ceid=US%3Aen
2024-08-20,"NVIDIA ACE & Digital Human Technologies Showcased In First Game, Mecha BREAK. ",https://news.google.com/read/CBMimwFBVV95cUxPLXZDSy1XSklXNXhSSEdPdHB1SDBCdF9iY0VxN3BuQlFmY3E4blU2RllZQzgxM2xOZ282OXBtZmtMUGpib2xvQkpuYU9qcnpRaXNLbHBOci1pWEtTZWtjV3NqcHpvOENHU25HelFjWEppUzMxdFFFdWkxaFJHZnluaFkzV05LTkVHSjZPaThEckhLVTdwbjAyaGdxUQ?hl=en-US&gl=US&ceid=US%3Aen
2024-08-20,"Level Up: NVIDIA, MediaTek to Bring G-SYNC Display Technologies to More Gamers. ",https://news.google.com/read/CBMiZkFVX3lxTFBjZ3ZacDQxOHdiVDlDWE9iX1pTY2NlUXJreFM4X21tVURHX1NtMnhEczVtamZpUUFJMER5SnFxOFFyQkdMYUYwQnQtbkJzZDVzUjlZS1dEZ2hxZDhZNmI2bk9vVjVTZw?hl=en-US&gl=US&ceid=US%3Aen
2023-05-18,"GeForce RTX 4060 & RTX 4060 Ti Announced: Available From May 24th, Starting At $299. ",https://news.google.com/read/CBMidEFVX3lxTE4yR1FlTXNwVk1PMF93d0tlTFZuYjJSaDZLTWhETTBqdzAzajMyVXAxeldvTUpPR2pWbnJDOURKSEJMRjJyZHdNVVNSQkZsREpqWlJQa0o0aTZyOGNLOUNJTlFOcDVGcTdFcThYNFdrWU9EaVhP?hl=en-US&gl=US&ceid=US%3Aen
2023-04-12,"NVIDIA GeForce RTX 4070 Brings Power of Ada Lovelace Architecture and DLSS 3 to Millions More Gamers and Creators, Starting at $599. ",https://news.google.com/read/CBMi9wFBVV95cUxQc0RVR0YtRkpvQnQ3MHBLbTRZZExMQkJnNENoazZfUVI4dDk2bF9WdGNmcVVla0lZRERGaWF5RFU3czVqMFNNUDBoNmFVc0V3VnpMVHNfOXhaa1B2bGRFMTNCa0Z0YnMtcUxRQ01kUDlxQmVhLTFEQ295c0pBNmRKaXFjR3E4YmdhY2xacE5JaVYwWkw1VlEzUE5jcV9NTm1id2t6bEZIdVpmT1Y0cVdHaGQwR3RvZ3BXVlJMVi12cjVfMUptV3RoWkpzYVpTdVFVR0thTzVUdG9GY2VWUlFRbDFhZnVsREd2NUhpMEJNZmVZVVdrQUtv?hl=en-US&gl=US&ceid=US%3Aen
2024-10-01,"NVIDIA App Beta Adds G-SYNC Controls, RTX HDR Multi-Monitor Support & More | GeForce News. ",https://news.google.com/read/CBMipgFBVV95cUxOQnhhS2R4cVo5Q1FGMkViaDFpeTdzVXlrVGNySlJxYnBMeVFLSEpkekUzcjNzUnpiZElJZlNkUi1NVEQwcWdWT1N1dUM2NlZQbFVETkF5LVlaU3ZoMWFZNjEwdmdyOXpuSVM0UWlJT2lFbGNpcnkyNEdEb0hUV1l2TVBtX2tiRV9XZnJ3VTIwaDNBbnpsT1dFTlN2SE1NOVp4WEdrWTln?hl=en-US&gl=US&ceid=US%3Aen
2023-10-20,Eureka! NVIDIA Research Breakthrough Puts New Spin on Robot Learning. ,https://news.google.com/read/CBMiZkFVX3lxTE5Qckpuck9pTVpJelltczBsU2dabllQS1FtekIyRTliVTlPX3pzaDRjUlEtYm4xYVNpa0RtcTV5LXVyWXlxRXZCYkV3a0hvUndNaVhXRlFmUlZkaFIwRi1WTThnTEJRQQ?hl=en-US&gl=US&ceid=US%3Aen
2023-08-23,NVIDIA Announces Financial Results for Second Quarter Fiscal 2024. ,https://news.google.com/read/CBMiogFBVV95cUxQdTZ2SjE3MlZEVnRScnctOTZfUWFUSmVOX3Bnd29fWXNqYklEM2kyd0EzZVd6RVczMDd1STRoRXdnYTJGLXM2UGNXTU1RTEJhNzU2bURPN2N0SG1SMFNhek13WlZHbzM5X1V5ZlhFbVRxaU4xQUVvU1BYY2hwd29WX0RkdXhuTUxHcktER29GTnRETGg4dHQzY3NwT3BKbVB1T2c?hl=en-US&gl=US&ceid=US%3Aen
2024-06-02,Introducing Project G-Assist: A Preview Of How AI Assistants Can Enhance Games & Apps. ,https://news.google.com/read/CBMickFVX3lxTFBVb01odWtOeW9wa2ZnY1ByWEFoMUpFLUliQ0pDZmptbXBVeEE3QUEtYURXOTJ0cldBOS04MllnbC1sMmlXMWV4S3haSTJYVnVTWThnY0RHMnFodHpfQmRCbXVqUkh4dUE1eUhCZ2UyaFdPdw?hl=en-US&gl=US&ceid=US%3Aen
2023-05-28,NVIDIA Announces DGX GH200 AI Supercomputer. ,https://news.google.com/read/CBMihAFBVV95cUxNT2UxRWxaMkQ1REJSMC1YWHA3aENTUzNWeFlkb3NjY2VBWTcydFpXalZIREc2cjdfa19hLTBKS2Jndk9pTHVVaVNubUhjamJpaTd6SUkyNTdGTVZ5cnA3Rjdmc1lkNmhreWszTUhWNnlaMmRVMFAzY1dmWFlYMGFSNzFrQUQ?hl=en-US&gl=US&ceid=US%3Aen
2024-03-18,"NVIDIA Healthcare Launches Generative AI Microservices to Advance Drug Discovery, MedTech and Digital Health. ",https://news.google.com/read/CBMifkFVX3lxTE5qYnBFZUpZNTE4eldEZ3hXZnVzVXhWb1lybTBfUGlJZjlYV2ZUWjRMVk9rNGFyVUxOaTh5a09FMGotZTFPa1U0b2pnMndXN3YtTjhpa2tMZTNTam1BUzJGeURNQ19aRjNkekpfQVppRTl0d2RsVzctMzlRZlgtQQ?hl=en-US&gl=US&ceid=US%3Aen
2024-03-18,TSMC and Synopsys Bring Breakthrough NVIDIA Computational Lithography Platform to Production. ,https://news.google.com/read/CBMicEFVX3lxTFBKb0FtT1JvUThxVzlhaGRyUmt5TERGNGlQS1l3YmZBRzhXTGZMVEJGOXl4bkp6cVU1V1BJdkxYZU1weGRSX09HUGJ3NDI4dzdRYUdQRjlJM2NZMjFlOW5pZkYtSHVzeGtjWlluRGN3TG0?hl=en-US&gl=US&ceid=US%3Aen
2024-03-18,NVIDIA Omniverse Expands Worlds Using Apple Vision Pro. ,https://news.google.com/read/CBMiaEFVX3lxTE5BcEg2Z1V4cF9PRVRRSWxybHFWZGtFbE1YamVZVC1iNVpMdWpfWGo0OE8xbHhyMXVMU1VBV1k0cVJVMl9hSHN6VHZJRl80R1lGcWlqWUNfZG5ocXR5OVMzS2M4SFB4dHhR?hl=en-US&gl=US&ceid=US%3Aen
2023-08-22,"Announcing Half-Life 2 RTX, An RTX Remix Project Being Built By The Community. ",https://news.google.com/read/CBMihgFBVV95cUxOS2tTWDl1OXhVblpOcXcxLXZYNGYwdUxNZ0lVcUdTc2dTN3o5TUpadE9QSFA0cjZnNm81RkRPNFptN1JUWWFVV01tbXp0ZTZqT19wSVBMWl9wRHRWV0ZNQUtkRVFvOEFHNmVESlpnSDhIbHZoVkNvVUFNRmhJSE9EMG9XMmFyUQ?hl=en-US&gl=US&ceid=US%3Aen
2024-08-20,Black Myth: Wukong & Star Wars™ Outlaws GeForce Game Ready Driver Released. ,https://news.google.com/read/CBMipwFBVV95cUxNSXhMUmVGcVpmbHp5LUQxVl9qU1Y1R3M1UGdYYk5pdXBpeTNWaHozYnZkRTJWMmlXSzhGOEtJTVlnWHB6MXBnNVRseDlpeWF1Nkt1Q1FQWlpZWnhFRTViSnMyaGh6R3pxa002endKblBkSW1vQi1LRHBlSXM0d1A3T1E5QzFXYVRNVVZVLTMzUnEwbDBITzdqeDVDdkRJVFlqeF9OazJZcw?hl=en-US&gl=US&ceid=US%3Aen
2023-02-28,"Game Ready Driver Released For Atomic Heart DLSS 3, THE FINALS Closed Beta & RTX Video Super Resolution. ",https://news.google.com/read/CBMipgFBVV95cUxOMl81d3Nodm5IN1BTNjcxTTZSdDROS0dqMkhzSnZyTlRyZUpQU0daRUJBZEdZY3lERl9ORXZxTXdJUWx2eGtUdUF4Z1pSOG5pdE91U3pWWWdueHJCd3NFUGg1YWRjRS1LbGRIX014Ni1RbGZyZS00SWtjMXlEMGxZRUVQRzRVUFlCaV9EWmxWaExLb0NUaHBDZ3FUZEhhNVJrcFVaa3F3?hl=en-US&gl=US&ceid=US%3Aen
2023-09-27,Counter-Strike 2 with NVIDIA Reflex and GeForce RTX 40 Series GPUs - The Lowest System Latency & Highest FPS. ,https://news.google.com/read/CBMilwFBVV95cUxPWURHLVhPM1Ywd3p1ZER5YUJGOUtlNDlUWDdudGtjOUdwLWl2aUsxT2EtVEJrLXRFMVFBS1IxQm9JMXBSbEE5NHRJT3ptNTlGV0xUMlBtUDJITDhnRkJtUTdaUDdnVV82VGRKNVJBVndrMFFfUXJPMHhRaHhNN3p4ZmtvN25zdlhOZGd2S01JYVhRY2Yxeksw?hl=en-US&gl=US&ceid=US%3Aen
2024-08-09,"California, NVIDIA launch first-of-its-kind AI collaboration. ",https://news.google.com/read/CBMimgFBVV95cUxOeks4N1otNGNYVGw1MTZoTnBZNVdfZnZja2tRZFBLMEdseWZOZ0o1aFUxVlprTzFhV00xSFVrZjY1NXFLX0phSVVMVF9ydjk2X2N5SXRVSlVsZXFFQktMNDRXRWVKbEl1cmpyNGdDdVIwS2JLanplSENKeDR0SUJPMy0xZ1dBV2pxdlZ0eWRoTGZBMTR5U0JmX2Zn?hl=en-US&gl=US&ceid=US%3Aen
2023-05-28,Live From Taipei: NVIDIA CEO Unveils Gen AI Platforms for Every Industry. ,https://news.google.com/read/CBMibkFVX3lxTE1ESGVURmVDSk9UMmQ4am9CZnp5bWpXcFdSVXhBa1ZrdXpaOVRKOGdXUUxkSEtZWTdoUmJwRnhNandNa2FfOW5sdGxtdXczTDlPMlVlZDJLNjlJa3lZZG1LaU1qTmI2elRLY21Fb21B?hl=en-US&gl=US&ceid=US%3Aen
2023-05-30,Diablo IV GeForce Game Ready Driver Released. ,https://news.google.com/read/CBMiekFVX3lxTE1YUVBDWDNyTXBaWlkxUGR3UGpKWHJFM1YzS0dhcW05VzY5akkwWDJRSGdpbDN1WEdwYkU3OXQxdXQ4N3RiRm1pVzdDV0F2NXZpdkZzbVQ4MkpEOTRUeGtpeXpvTmVnWTFFY2prY0xDdHJpeDFCQmdNdHVB?hl=en-US&gl=US&ceid=US%3Aen
2024-01-08,"NVIDIA Reveals Gaming, Creating, Generative AI, Robotics Innovations at CES. ",https://news.google.com/read/CBMiUEFVX3lxTE9HcTN3bndGaHFRVE9mUThONkswbTQyLV8wd1dLNDlBWlo4Z09qUkxNSEVCazAyVFpGZDV2Yk5LMDJ5QWhacHlXQ0ktWTBWRGFq?hl=en-US&gl=US&ceid=US%3Aen
2023-05-28,NVIDIA Grace Hopper Superchips Designed for Accelerated Generative AI Enter Full Production. ,https://news.google.com/read/CBMixAFBVV95cUxQdzJIZEJReE5OVW53LThnRkFJWEFwdngyNmptWlFGMWx6UHhDM3pzYjI2SmUtaERyZnVJRTN1TFNhR1lhLWtRVWhRSUJhMl84Yy1nQUp3NXluTHZORXVpZUxFbVhJdmM3bjgzaGoyclFQOUR0T2RxNjhDMU9xZVhmRkFEb3d2b2tzazlFcGpyY2lGcDdWUkhpdVNXNHlBOU50elV5QkFOYTFvMU9FX2xSUmNwQnctUUtYRENKT3FoSXFwSDds?hl=en-US&gl=US&ceid=US%3Aen
2024-01-08,"G-SYNC Displays Dazzle At CES 2024: G-SYNC Pulsar Tech Unveiled, G-SYNC Comes To GeForce NOW, Plus 24 New Models. ",https://news.google.com/read/CBMie0FVX3lxTE90SDg4WmpSN2lCb3ByYjlWLThFWWEwT0k3YzRYU3podm5WUHE3dERsNVh5MDBJei1zR1pwLUlMd0libl9GVzhxaHNUMHdtNkMtanJtWUl0WGhQYzZnRDFGd1ZJNFNxQzRQZDQwV3pHcHAtTGtBWWU0NzAwRQ?hl=en-US&gl=US&ceid=US%3Aen
2020-05-22,"40 Years on, PAC-MAN Recreated with AI by NVIDIA Researchers. ",https://news.google.com/read/CBMidEFVX3lxTE8zSmtrdEt0OXZtenAtWU9yTnlIMUxldGhLbDNPb2l6cTBTN2NoeW05SlhZbk5LdUtvaC1xU1lEd19FczhubWw3MXRKS0UxUWJXa3dsNXZvTTZZZWtTbGdodHhIckY2dmZUdXRsX1F1a1UwZlc4?hl=en-US&gl=US&ceid=US%3Aen
2023-04-12,"Introducing GeForce RTX 4070: NVIDIA Ada Lovelace & DLSS 3, Starting At $599. ",https://news.google.com/read/CBMia0FVX3lxTE11TjRlbmxOZExJOXQ5UkdXb09mZ1ZVVl9aN3BxdHExMjFiYW9wdk1qRTVwU013RnJQV1UxeWpCZ0tEdWxmZkR5c2VvME1jUHhpNWJja3N0MDJfSVpQTTVfQjFvQkdBS0tpWUtn?hl=en-US&gl=US&ceid=US%3Aen
2024-02-20,"See the Future at GTC 2024: NVIDIA’s Jensen Huang to Unveil Latest Breakthroughs in Accelerated Computing, Generative AI and Robotics. ",https://news.google.com/read/CBMi9wFBVV95cUxNUWNWemZ2UUJQRURGMVI2M2YwMFE1NmdxV2l5Q2w4UG5kbjdmOGdzUmxZNzRQdEJwRTNaQmtORm5iM3o1bEZoU0ZSanl4aFdDYkNRZHhEU1gwXzhZOFl3WUEyaWlva1Z2ekVFZmdRMUw0M0ZOS0hZR3RQOGZnbXdOOXBQX0dnQVU1VXoybUhVS3NfX3BrbzBKNnFiRTFMcXUtaHVNSGowMzhQcVJBdVRBeG1pRlNvaWtLMkJ1SEtQTFI2YzRwck1WSlpzSWhuNEJuYW9uMElPMDY2QnJHMlYweElLWUNweFd2U0gzUjQ2bmNDWG1QcTBB?hl=en-US&gl=US&ceid=US%3Aen
2024-08-27,NVIDIA and Global Partners Launch NIM Agent Blueprints for Enterprises to Make Their Own AI. ,https://news.google.com/read/CBMixAFBVV95cUxQYzNudl9NWjQ5bnhSRDZnNTZabUpmT2JQRjZWakpUb1VLZlFfYXFHUVo0WUxkYnlCcVZsekpfWmJBcmtKYVpKcTRUT0xRMVFERHNhb2VZVG01THFPOUFDRzBBRUZGQXh6RnRTNWVtUEhWajhpcFJIVXo0cHd4dVgyZmJEMk9ub3dmOWpvdldyeGNoSGdhdlM0enJoY2VkczdYUDRRa2tIZFRaN2RKSW5fLW1wSktmWkRaVHZ6RnlqZF9WcWtG?hl=en-US&gl=US&ceid=US%3Aen
2024-05-15,Fire It Up: Mozilla Firefox Adds Support for AI-Powered NVIDIA RTX Video. ,https://news.google.com/read/CBMiakFVX3lxTFBoaFg2Z1pvS3lVN28zTEx1akE2X2JrNVloU1B6aFhuSEcwT2VGU0Z3WnZhbGtvM095RXQ2LXdiZktaVFlEY1RqM0pnRmpTeXRpZE9GTllybEpWcWRfTWNIcDRSV0tSTGFHdUE?hl=en-US&gl=US&ceid=US%3Aen
2023-03-21,"GTC Keynote Wrap-Up: NVIDIA to Bring AI to Every Industry, CEO Says. ",https://news.google.com/read/CBMiZEFVX3lxTE12cE9rZHdDdWN3RXRnRmhfZFlZMXJmaEtpSVNQWUUzWlFzX05nN1RfeHNEWV9EdnBXNlRiSlJqV3lubGR2RHhmYjdrSWdFV1RhYm9pVFZycnMyZVVpMG8wMkdCbDA?hl=en-US&gl=US&ceid=US%3Aen
2023-12-04,NVIDIA ACE. ,https://news.google.com/read/CBMiR0FVX3lxTE1CSDV5bVNUSHMtOHVBTUJqNVVnb0hTb0k5WWN1dTgzRlBpN2ZRZ1c1SmppckZzM2xpOHdPQWpnRDV2WXFRX2hJ?hl=en-US&gl=US&ceid=US%3Aen
