date,news_content,url
2024-10-08,"UBS Reiterates Buy on NVIDIA, Maintains $150 Price Target",https://www.benzinga.com/news/24/10/41231711/ubs-reiterates-buy-on-nvidia-maintains-150-price-target
2024-10-08,Where NVIDIA Stands With Analysts,https://www.benzinga.com/insights/analyst-ratings/24/10/41232030/where-nvidia-stands-with-analysts
2024-10-08,"Rising Yields And Higher Neutral Rate May Spoil The Party, Biggest Stock Moves In Years Ahead",https://www.benzinga.com/federal-reserve/24/10/41232664/rising-yields-and-higher-neutral-rate-may-spoil-the-party-biggest-stock-moves-in-years-ahead
2024-10-08,Jensen Huang To Keynote CES 2025 As 'True Visionary In The Tech Industry': How Much Did Nvidia Stock Rise Since Last Year's Show?,https://www.benzinga.com/tech/24/10/41234323/jensen-huang-to-keynote-ces-2025-as-true-visionary-in-the-tech-industry-how-much-did-nvidia-stock-ri
2024-10-08,"Nvidia, AMD Lead The Pack, Broadcom Stable, Intel Falters: Analyst's Latest Take",https://www.benzinga.com/analyst-ratings/analyst-color/24/10/41235547/nvidia-amd-lead-the-pack-broadcom-stable-intel-falters-analysts-latest-take
2024-10-08,10 Information Technology Stocks With Whale Alerts In Today's Session,https://www.benzinga.com/insights/options/24/10/41235994/10-information-technology-stocks-with-whale-alerts-in-todays-session
2024-10-08,"Stocks Rally As Oil Prices Tumble; Tech, Chipmakers Lead As Traders Focus On AI Winners Before Earnings Season: What's Driving Markets Tuesday?",https://www.benzinga.com/news/earnings/24/10/41236355/stocks-rally-as-oil-prices-tumble-tech-chipmakers-lead-as-traders-focus-on-ai-winners-before-earnin
2024-10-08,"Cantor Fitzgerald Reiterates Overweight on NVIDIA, Maintains $175 Price Target",https://www.benzinga.com/news/24/10/41238498/cantor-fitzgerald-reiterates-overweight-on-nvidia-maintains-175-price-target
2024-10-08,S&P 500 Earnings Season Kicks Off: Why Analysts Call This Quarter 'A Stock Picker's Paradise',https://www.benzinga.com/analyst-ratings/analyst-color/24/10/41239978/s-p-500-earnings-season-kicks-off-why-analysts-call-this-quarter-a-stock-pickers-pa
2024-10-08,Astera Labs Stock Jumps After The Bell: What's Happening?,https://www.benzinga.com/news/24/10/41240051/astera-labs-stock-jumps-after-the-bell-whats-happening
2024-10-08,"Bitcoin, Dogecoin Muted, Ethereum Gains Amid Stocks Rebound: Analyst Says ETH Surpassing BTC's Returns Inevitable — 'The Beast Will Take Over And Continue To Outperform'",https://www.benzinga.com/markets/cryptocurrency/24/10/41242963/bitcoin-dogecoin-muted-ethereum-gains-amid-stocks-rebound-analyst-says-eth-surpassing-btcs
2024-10-09,"S&P Gains 1% As Nvidia, Broadcom Shares Surge: Investor Optimism Improves, Fear Index Remains In 'Greed' Zone",https://www.benzinga.com/news/earnings/24/10/41244306/s-p-gains-1-as-nvidia-broadcom-shares-surge-investor-optimism-improves-fear-index-remains-in-greed-
2024-10-09,Nvidia Poised To Overtake Apple As World's Most Valuable Company: How Much Jensen Huang's Company Needs To Gain By Wednesday,https://www.benzinga.com/markets/equities/24/10/41245350/nvidia-poised-to-overtake-apple-as-worlds-most-valuable-company-how-much-jensen-huangs-company-n
2024-10-09,"US Stocks Set To Open Marginally Lower, Nvidia Gains, Traders Eye Fed Minutes: Strategist Predicts Many More Years Of Gains Ahead Of Bull Market's 2nd Anniversary",https://www.benzinga.com/news/earnings/24/10/41247174/us-stocks-set-to-open-marginally-lower-nvidia-gains-traders-eye-fed-minutes-strategist-predicts-man
2024-10-09,"Trading Taiwan Semiconductor's Upcoming Litmus Test Through Direxion's TSMX, TSMZ Funds",https://www.benzinga.com/trading-ideas/long-ideas/24/10/41247343/trading-taiwan-semiconductors-upcoming-litmus-test-through-direxions-tsmx-tsmz-funds
2024-10-09,"Why Nvidia, Apple Chip Supplier TSMC Stock Is Rallying In Wednesday's Premarket",https://www.benzinga.com/markets/equities/24/10/41248508/why-nvidia-apple-chip-supplier-tsmc-is-rallying-in-wednesdays-premarket
2024-10-09,What's Going On With Astera Labs Stock Wednesday?,https://www.benzinga.com/news/24/10/41250240/whats-going-on-with-astera-labs-stock-wednesday
2024-10-09,"Top 10 Trending Stocks On WallStreetBets As Of October 9, 2024 (Via Swaggy Stocks)",https://www.benzinga.com/trading-ideas/24/10/41250354/top-10-trending-stocks-on-wallstreetbets-as-of-october-9-2024-via-swaggy-stocks
2024-10-09,"Market Clubhouse Morning Memo - October 9th, 2024 (Trade Strategy For SPY, QQQ, AAPL, MSFT, NVDA, GOOGL, META And TSLA)",https://www.benzinga.com/trading-ideas/24/10/41252541/market-clubhouse-morning-memo-october-9th-2024-trade-strategy-for-spy-qqq-aapl-msft-nvda-googl-meta
2024-10-09,"Google Breakup On The Table, Nvidia AI Summit Moves The Stock But Resistance Ahead",https://www.benzinga.com/general/market-summary/24/10/41254002/google-breakup-on-the-table-nvidia-ai-summit-moves-the-stock-but-resistance-ahead
2024-10-09,A Look Into NVIDIA Inc's Price Over Earnings,https://www.benzinga.com/insights/news/24/10/41256667/a-look-into-nvidia-incs-price-over-earnings
2024-10-09,10 Information Technology Stocks With Whale Alerts In Today's Session,https://www.benzinga.com/insights/options/24/10/41256839/10-information-technology-stocks-with-whale-alerts-in-todays-session
2024-10-09,Cathie Wood's Ark Invest Swoops In To Buy AMD Shares As Nvidia Looms Large,https://www.benzinga.com/markets/equities/24/10/41263751/cathie-woods-ark-invest-swoops-in-to-buy-amd-shares-as-nvidia-looms-large
2024-10-10,"Marjorie Taylor Greene Boosts Stock Portfolio With AI Exposure, Buys JPMorgan And This Hot Magnificent 7 Stock: Here're Congresswoman's Latest Trades",https://www.benzinga.com/markets/equities/24/10/41266843/marjorie-taylor-greene-boosts-stock-portfolio-with-ai-exposure-buys-jpmorgan-and-this-hot-magnif
2024-10-10,"Morgan Stanley Reiterates Overweight on NVIDIA, Maintains $150 Price Target",https://www.benzinga.com/news/24/10/41270498/morgan-stanley-reiterates-overweight-on-nvidia-maintains-150-price-target
2024-10-10,"Jim Cramer Likes Reddit Very Much, Calls Accenture A 'Great Buy'",https://www.benzinga.com/trading-ideas/long-ideas/24/10/41270853/jim-cramer-likes-reddit-very-much-calls-accenture-a-great-buy
2024-10-10,"Top 10 Trending Stocks On WallStreetBets As Of October 10, 2024 (Via Swaggy Stocks)",https://www.benzinga.com/trading-ideas/24/10/41271768/top-10-trending-stocks-on-wallstreetbets-as-of-october-10-2024-via-swaggy-stocks
2024-10-10,"Market Clubhouse Morning Memo - October 10th, 2024 (Trade Strategy For SPY, QQQ, AAPL, MSFT, NVDA, GOOGL, META And TSLA)",https://www.benzinga.com/markets/24/10/41273679/market-clubhouse-morning-memo-october-10th-2024-trade-strategy-for-spy-qqq-aapl-msft-nvda-googl-meta
2024-10-10,Hotter Inflation But Jobless Claims Cushion The Blow – Selling In Nvidia And AI Stocks,https://www.benzinga.com/general/market-summary/24/10/41276483/hotter-inflation-but-jobless-claims-cushion-the-blow-selling-in-nvidia-and-ai-stocks
2024-10-10,Taiwan Semiconductor Vs. Broadcom: Who Will Be The Next Trillion-Dollar AI Giant?,https://www.benzinga.com/trading-ideas/technicals/24/10/41276711/taiwan-semiconductor-vs-broadcom-who-will-be-the-next-trillion-dollar-ai-giant
2024-10-10,10 Information Technology Stocks Whale Activity In Today's Session,https://www.benzinga.com/insights/options/24/10/41278171/10-information-technology-stocks-whale-activity-in-todays-session
2024-10-10,Josh Brown Flags 'Monster' Call Buying In Nvidia Up To $190 Strike: 'This Is Not Retail Money',https://www.benzinga.com/trading-ideas/long-ideas/24/10/41279473/josh-brown-flags-monster-call-buying-in-nvidia-up-to-190-strike-this-is-not-retail-money
2024-10-10,"18 Stocks To Buy, 7 To Sell This Earnings Season: Goldman Sachs Calls It 'The Year Of The Stock Picker'",https://www.benzinga.com/analyst-ratings/analyst-color/24/10/41281645/18-stocks-to-buy-7-to-sell-this-earnings-season-goldman-sachs-calls-it-the-year-of-
2024-10-10,"Nvidia's Blackwell Chip Faces AMD's MI350 Challenge In 2025: CEO Lisa Su Says, 'Beginning, Not The End Of The AI Race'",https://www.benzinga.com/news/24/10/41284533/nvidias-blackwell-chip-faces-amds-mi350-challenge-in-2025-ceo-lisa-su-says-beginning-not-the-end-of
2024-10-10,"Retail Traders Unfazed By AI Hype, Most Say 2024 Election Is As Relevant To Portfolios As A Magic 8-Ball",https://www.benzinga.com/general/politics/24/10/41283480/retail-traders-unfazed-by-ai-hype-most-say-2024-election-is-as-relevant-to-portfolios-as-a-magic
2024-10-11,"Nvidia, Samsara And More On CNBC's 'Final Trades'",https://www.benzinga.com/trading-ideas/long-ideas/24/10/41290704/nvidia-samsara-and-more-on-cnbcs-final-trades
2024-10-11,"Top 10 Trending Stocks On WallStreetBets As Of October 11, 2024 (Via Swaggy Stocks)",https://www.benzinga.com/trading-ideas/24/10/41291140/top-10-trending-stocks-on-wallstreetbets-as-of-october-11-2024-via-swaggy-stocks
2024-10-11,NVIDIA Options Trading: A Deep Dive into Market Sentiment,https://www.benzinga.com/insights/options/24/10/41291676/nvidia-options-trading-a-deep-dive-into-market-sentiment
2024-10-11,"Goldman Sachs Maintains Buy on NVIDIA, Raises Price Target to $150",https://www.benzinga.com/news/24/10/41291773/goldman-sachs-maintains-buy-on-nvidia-raises-price-target-to-150
2024-10-11,Nvidia Stock Surges As AI Dominance Fuels Long-Term Bull Run: Gene Munster Waves Green Flag,https://www.benzinga.com/trading-ideas/technicals/24/10/41292954/nvidia-stock-surges-as-ai-dominance-fuels-long-term-bull-run-gene-munster-waves-green-fl
2024-10-11,Analyzing NVIDIA In Comparison To Competitors In Semiconductors &amp; Semiconductor Equipment Industry,https://www.benzinga.com/insights/news/24/10/41293147/analyzing-nvidia-in-comparison-to-competitors-in-semiconductors-amp-semiconductor-equipment-industr
2024-10-11,"Humanoid Robots May Be Biggest Product Ever, Sell The News On Tesla's We, Robot And AMD's AI Event",https://www.benzinga.com/general/market-summary/24/10/41293772/humanoid-robots-may-be-biggest-product-ever-sell-the-news-on-teslas-we-robot-and-amds-ai-e
2024-10-11,Does Jensen Huang Check Nvidia Stock Price Daily?,https://www.benzinga.com/news/management/24/10/41294313/does-jensen-huang-check-nvidia-stock-price-daily
2024-10-11,10 Information Technology Stocks Whale Activity In Today's Session,https://www.benzinga.com/insights/options/24/10/41296461/10-information-technology-stocks-whale-activity-in-todays-session
2024-10-11,AMD Stock: Can Its AI Strategy Compete With Nvidia? Analyst Predicts Market Share Gains Ahead,https://www.benzinga.com/analyst-ratings/analyst-color/24/10/41290409/amd-stock-can-its-ai-strategy-compete-with-nvidia-analyst-predicts-market-share-gai
2024-10-12,"Elon Musk To End Year As Richest Man In The World? Prediction Market Says Yes, Higher Chance Than Larry Ellison Or Jensen Huang",https://www.benzinga.com/news/management/24/10/41302431/elon-musk-to-end-year-as-richest-man-in-the-world-prediction-market-says-yes-higher-chance-than-l
2024-10-12,"Benzinga Bulls And Bears: Nvidia, Rivian, Alphabet, Palantir — And Crypto Trader Says Shiba Inu 'Will Accelerate'",https://www.benzinga.com/markets/cryptocurrency/24/10/41302752/benzinga-bulls-and-bears-nvidia-rivian-alphabet-palantir-and-crypto-trader-says-shiba-inu-
2024-10-13,"Election Interference, Superchip Factories, And Trillion-Dollar Opportunities: AI Takes Center Stage",https://www.benzinga.com/news/24/10/41304567/election-interference-superchip-factories-and-trillion-dollar-opportunities-ai-takes-center-stage
2024-10-13,"Consumer Tech News (Oct 7-Oct 11): Apple TV+ To Be Available Through Prime Video, Tesla Robotaxi To Disrupt Autonomous Driving Market & More",https://www.benzinga.com/news/24/10/41304752/consumer-tech-news-oct-7-oct-11-apple-tv-to-be-available-through-prime-video-tesla-robotaxi-to-disru
2024-10-14,Nvidia CEO Jensen Huang Praises Elon Musk For Achieving Something With xAI In 19 Days That Usually Takes At Least A Year: 'Singular In His Understanding Of Engineering',https://www.benzinga.com/news/24/10/41307824/nvidia-ceo-jensen-huang-praises-elon-musk-for-achieving-something-with-xai-in-19-days-that-usually-t
2024-10-14,"Nvidia's Jensen Huang Says ChatGPT Led To 'Awakening Of AI,' Praises Sam Altman's OpenAI As One Of Most Consequential Companies Of Our Time",https://www.benzinga.com/news/24/10/41309060/nvidias-jensen-huang-says-chatgpt-led-to-awakening-of-ai-praises-sam-altmans-openai-as-one-of-most-c
2024-10-14,"Top 10 Trending Stocks On WallStreetBets As Of October 14, 2024 (Via Swaggy Stocks)",https://www.benzinga.com/trading-ideas/24/10/41312645/top-10-trending-stocks-on-wallstreetbets-as-of-october-14-2024-via-swaggy-stocks
2024-10-14,'Most Widely Hated' Bull Market Reaches 2-Year Milestone: Top 20 S&P 500 Stocks Driving The Rally,https://www.benzinga.com/analyst-ratings/analyst-color/24/10/41314387/most-widely-hated-bull-market-reaches-2-year-milestone-top-20-s-p-500-stocks-drivin
2024-10-14,"Market Clubhouse Morning Memo - October 14th, 2024 (Trade Strategy For SPY, QQQ, AAPL, MSFT, NVDA, GOOGL, META And TSLA)",https://www.benzinga.com/markets/24/10/41314547/market-clubhouse-morning-memo-october-14th-2024-trade-strategy-for-spy-qqq-aapl-msft-nvda-googl-meta
2024-10-14,"Bonds Defy Expectations, Earnings Season Will Be A Tell For AI",https://www.benzinga.com/general/market-summary/24/10/41315844/bonds-defy-expectations-earnings-season-will-be-a-tell-for-ai
2024-10-14,What's Going On With Nvidia Stock On Monday?,https://www.benzinga.com/news/24/10/41317732/whats-going-on-with-nvidia-stock-on-monday
2024-10-14,10 Information Technology Stocks Whale Activity In Today's Session,https://www.benzinga.com/insights/options/24/10/41318625/10-information-technology-stocks-whale-activity-in-todays-session
2024-10-14,"NVIDIA, Trump Media & Technology, Bausch + Lomb, Sirius XM And Other Big Stocks Moving Higher On Monday",https://www.benzinga.com/news/24/10/41318786/nvidia-trump-media-technology-bausch-lomb-sirius-xm-and-other-big-stocks-moving-higher-on-monday
2024-10-14,Taiwan Semiconductor Eyes $23B in Q3 Revenue as AI Demand Soars,https://www.benzinga.com/news/24/10/41319208/taiwan-semiconductor-eyes-23b-in-q3-revenue-as-ai-demand-soars
2024-10-14,"Nvidia, Microstrategy, Trump Media & Technology, Sofi Technologies, And Tesla: Why These 5 Stocks Are On Investors' Radars Today",https://www.benzinga.com/markets/equities/24/10/41322863/nvidia-microstrategy-trump-media-technology-sofi-technologies-and-tesla-why-these-5-stocks-are-o
2024-10-14,"Bitcoin, Ethereum, Dogecoin Soar As Stocks Register New All-Time Highs: Top Analyst Says King Crypto On Track Toward $78K",https://www.benzinga.com/markets/cryptocurrency/24/10/41322892/bitcoin-ethereum-dogecoin-soar-as-stocks-register-new-all-time-highs-top-analyst-says-king
2024-10-15,"Nvidia, AMD Face Chip Export Curbs, As Biden Administration Considers Restrictions On Middle-East Countries, Others: Report",https://www.benzinga.com/news/24/10/41323155/nvidia-amd-face-chip-export-curbs-as-biden-administration-considers-restrictions-on-middle-east-coun
2024-10-15,"Wall Street On Edge As Nasdaq Nears Record High, Oil Prices Plummet: Strategist Says There's Opportunity If Resilience Continues",https://www.benzinga.com/news/earnings/24/10/41326823/wall-street-on-edge-as-nasdaq-nears-record-high-oil-prices-plummet-strategist-says-theres-opportuni
2024-10-15,"Why Nvidia, AMD And Other Chipmakers Are Moving Lower In Tuesday's Premarket",https://www.benzinga.com/markets/equities/24/10/41328454/why-nvidia-amd-and-other-chipmakers-are-moving-lower-in-tuesdays-premarket
2024-10-15,"Nvidia, PayPal, United Rentals And An Energy Stock On CNBC's 'Final Trades'",https://www.benzinga.com/trading-ideas/long-ideas/24/10/41331079/nvidia-paypal-united-rentals-and-an-energy-stock-on-cnbcs-final-trades
2024-10-15,"Top 10 Trending Stocks On WallStreetBets As Of October 15, 2024 (Via Swaggy Stocks)",https://www.benzinga.com/trading-ideas/24/10/41332662/top-10-trending-stocks-on-wallstreetbets-as-of-october-15-2024-via-swaggy-stocks
2024-10-15,"Amazon Strikes at Nvidia's Stronghold Through Databricks Deal, Cutting AI Costs by 40%",https://www.benzinga.com/news/24/10/41337034/amazon-strikes-at-nvidias-stronghold-through-databricks-deal-cutting-ai-costs-by-40
2024-10-15,"Market Clubhouse Morning Memo - October 15th, 2024 (Trade Strategy For SPY, QQQ, AAPL, MSFT, NVDA, GOOGL, META And TSLA)",https://www.benzinga.com/trading-ideas/24/10/41337996/market-clubhouse-morning-memo-october-15th-2024-trade-strategy-for-spy-qqq-aapl-msft-nvda-googl-met
2024-10-15,"ASML Earnings Leak Sparks Broad Semiconductor Sell-Off, Sector Down Sharply As Dutch Chipmaker Lowers 2025 Outlook",https://www.benzinga.com/markets/equities/24/10/41339229/asml-earnings-leak-sparks-broad-semiconductor-sell-off-sector-down-sharply-as-dutch-chipmaker-lo
2024-10-15,"Nvidia and Intel Competition Threaten AMD's Growth, Analyst Says",https://www.benzinga.com/analyst-ratings/analyst-color/24/10/41339315/nvidia-and-intel-competition-threaten-amds-growth-analyst-says
2024-10-15,"Google Goes Nuclear For AI Power, Israeli Restraint Impacts Stocks, Gold, And Oil",https://www.benzinga.com/markets/24/10/41339316/google-goes-nuclear-for-ai-power-israeli-restraint-impacts-stocks-gold-and-oil
2024-10-15,10 Information Technology Stocks Whale Activity In Today's Session,https://www.benzinga.com/insights/options/24/10/41341102/10-information-technology-stocks-whale-activity-in-todays-session
2024-10-15,"Chipmaker Stocks Sink On ASML Earnings Leak, Oil Eyes Worst 1-Day Drop This Year, Small Caps Rally: What's Driving Markets Tuesday?",https://www.benzinga.com/markets/equities/24/10/41341168/chipmaker-stocks-sink-on-asml-earnings-leak-oil-eyes-worst-1-day-drop-this-year-small-caps-rally
2024-10-15,"Marvell Showcases Next-Gen 3nm Technology, Doubling Data Speeds for AI Systems",https://www.benzinga.com/news/24/10/41341809/marvell-showcases-next-gen-3nm-technology-doubling-data-speeds-for-ai-systems
2024-10-15,Unlikely S&P 500 Stock Leaves Nvidia Behind With 241% Gain In 2024,https://www.benzinga.com/trading-ideas/technicals/24/10/41342499/unlikely-s-p-500-stock-leaves-nvidia-behind-with-241-gain-in-2024
2024-10-15,"Nvidia, Apple, And Microsoft In Race For $4 Trillion Market Cap: 'Stage Is Set For Tech Stocks For Another 20% Move Higher In 2025'",https://www.benzinga.com/markets/equities/24/10/41348844/nvidia-apple-and-microsoft-in-race-for-4-trillion-market-cap-stage-is-set-for-tech-stocks-for-an
2024-10-15,"Bitcoin Marches Ahead, Ethereum, Dogecoin Flat Amid Stocks' Reversal: Analyst Highlights Factors Supporting King Crypto's Rise To $71K",https://www.benzinga.com/markets/cryptocurrency/24/10/41349325/bitcoin-marches-ahead-ethereum-dogecoin-flat-amid-stocks-reversal-analyst-highlights-facto
2024-10-16,"Amid Fear Of China's Access To Nvidia, AMD Chips Through Middle East, This CEO Assures UAE Reliable Partner For US: 'We Can Guarantee The Safety And Security Of This Technology'",https://www.benzinga.com/news/24/10/41350661/amid-fear-of-chinas-access-to-nvidia-amd-chips-through-middle-east-this-ceo-assures-uae-reliable-par
2024-10-16,"Nvidia, AMD, ASML And Other Chipmakers Drag Nasdaq Down: Fear Index Moves To 'Greed' Zone",https://www.benzinga.com/news/earnings/24/10/41350830/nasdaq-dips-1-amid-plunge-in-chipmaker-stocks-fear-greed-index-moves-to-greed-zone
2024-10-16,"After ASML Rocks AI Hardware Names, Gene Munster Explains Why It's 'Overreaction:' 'AI Trade Is On Track'",https://www.benzinga.com/analyst-ratings/analyst-color/24/10/41351475/after-asml-rocks-ai-hardware-names-gene-munster-explains-why-its-overreaction-ai-tr
2024-10-16,"ASML Struggles In Wednesday Pre-Market As Nvidia, AMD And Other Peers Begin Recovery From Chipmaker's Downward Pull",https://www.benzinga.com/news/24/10/41352550/asml-struggles-in-wednesday-pre-market-as-nvidia-amd-and-other-peers-begin-recovery-from-chipmakers
2024-10-16,"Jensen Huang Inches Closer To Top 10 Richest People In The World: Here's How Much More He Needs, How Much Nvidia Stock Must Rise",https://www.benzinga.com/general/education/24/10/41355157/jensen-huang-inches-closer-to-top-10-richest-people-in-the-world-heres-how-much-more-he-needs-h
2024-10-16,Super Micro Expands Liquid-Cooled AI Servers With Nvidia Power,https://www.benzinga.com/news/24/10/41355570/super-micro-expands-liquid-cooled-ai-servers-with-nvidia-power
2024-10-16,What's Going On With Serve Robotics Stock Wednesday?,https://www.benzinga.com/news/24/10/41356642/whats-going-on-with-serve-robotics-stock-wednesday
2024-10-16,"As Nvidia, Apple And Microsoft Race Towards $4 Trillion Valuation, Generative AI Startups Reportedly Draw 40% Of All VC Investment",https://www.benzinga.com/news/24/10/41357341/as-nvidia-apple-and-microsoft-race-towards-4-trillion-valuation-generative-ai-startups-reportedly-dr
2024-10-16,"Market Clubhouse Morning Memo - October 16th, 2024 (Trade Strategy For SPY, QQQ, AAPL, MSFT, NVDA, GOOGL, META And TSLA)",https://www.benzinga.com/markets/24/10/41358339/market-clubhouse-morning-memo-october-16th-2024-trade-strategy-for-spy-qqq-aapl-msft-nvda-googl-meta
2024-10-16,Smart Money Is Betting Big In NVDA Options,https://www.benzinga.com/insights/options/24/10/41358510/smart-money-is-betting-big-in-nvda-options
2024-10-16,ASML Stock Plunges Further On Lower 2025 Sales Outlook: Analysts Break Down Semiconductor Challenges,https://www.benzinga.com/analyst-ratings/analyst-color/24/10/41358875/asml-stock-plunges-further-on-lower-2025-sales-outlook-analysts-break-down-semicond
2024-10-16,"Alibaba And Baidu Bet Big On Autonomous Driving, Back $700M Horizon Robotics IPO",https://www.benzinga.com/news/24/10/41359993/alibaba-and-baidu-bet-big-on-autonomous-driving-back-700m-horizon-robotics-ipo
2024-10-16,"ASML Holding Stock Continues To Slide, Other Chipmakers Bounce Back: 'We Are Still Quite Optimistic About AI'",https://www.benzinga.com/news/earnings/24/10/41363734/asml-holding-stock-continues-to-slide-other-chipmakers-bounce-back-we-are-still-quite-optimistic-ab
2024-10-16,10 Information Technology Stocks Whale Activity In Today's Session,https://www.benzinga.com/insights/options/24/10/41364626/10-information-technology-stocks-whale-activity-in-todays-session
2024-10-16,"Lenovo's AI Push Grows with Meta, Nvidia Collaboration Outside China",https://www.benzinga.com/government/24/10/41365885/lenovos-ai-push-grows-with-meta-nvidia-collaboration-outside-china
2024-10-16,Nvidia Shares Are Rising Wednesday: What's Going On?,https://www.benzinga.com/news/24/10/41366135/nvidia-shares-are-rising-wednesday-whats-going-on
2024-10-16,King Nvidia Technicals Will Determine The Stock Market Direction — Overreaction To ASML Earnings,https://www.benzinga.com/news/24/10/41367354/king-nvidia-technicals-will-determine-the-stock-market-direction-overreaction-to-asml-earnings
2024-10-16,US Lawmakers Demand Tougher Action On Huawei's Secretive Chip Network,https://www.benzinga.com/markets/asia/24/10/41368844/us-lawmakers-demand-tougher-action-on-huaweis-secretive-chip-network
2024-10-17,"Nvidia Supplier TSMC Q3 Trumps Estimates On Strong AI Chip Demand, Guides Q4 Above Consensus (UPDATED)",https://www.benzinga.com/news/earnings/24/10/41373163/nvidia-supplier-tsmc-reports-q3-revenue-earnings-beat-amid-rising-demand-for-ai-chips
2024-10-17,"Amid Nvidia's Stratospheric Rally, Billionaire Investor Druckenmiller Regrets Cashing Out Of AI Stalwart's Stock: 'I'm Licking My Wounds From A Bad Sale'",https://www.benzinga.com/markets/equities/24/10/41374232/amid-nvidias-stratospheric-rally-billionaire-investor-druckenmiller-regrets-cashing-out-of-ai-st
2024-10-17,"Why Nvidia, AMD, Micron, Arm And Other Chipmakers Are Ripping Higher Premarket On Thursday",https://www.benzinga.com/markets/equities/24/10/41375295/why-nvidia-amd-micron-arm-and-other-chipmakers-are-ripping-higher-premarket-on-thursday
2024-10-17,Alibaba's Lazada Leverages AI in E-Commerce Race Against Shopee and TikTok Shop,https://www.benzinga.com/government/24/10/41380181/alibabas-lazada-leverages-ai-in-e-commerce-race-against-shopee-and-tiktok-shop
2024-10-15,"Shares of chip stocks are trading lower in sympathy with ASML, which fell after issuing soft guidance. Some stocks in the sector may also be down on reports indicating the US is discussing curbing chip exports to some countries.",https://www.benzinga.com/wiim/24/10/41336104/shares-of-chip-stocks-are-trading-lower-in-sympathy-with-asml-which-fell-after-issuing-soft-guidance
2024-10-17,"Market Clubhouse Morning Memo - October 17th, 2024 (Trade Strategy For SPY, QQQ, AAPL, MSFT, NVDA, GOOGL, META And TSLA)",https://www.benzinga.com/markets/24/10/41382818/market-clubhouse-morning-memo-october-17th-2024-trade-strategy-for-spy-qqq-aapl-msft-nvda-googl-meta
2024-10-17,"AI Chip Manufacturer Breaks Out – Nvidia May Be Next, Consumer Splurges, Fed Spiked The Punch",https://www.benzinga.com/general/market-summary/24/10/41385390/ai-chip-manufacturer-breaks-out-nvidia-may-be-next-consumer-splurges-fed-spiked-the-punch
2024-10-17,"Apple's 3nm Push Boosts Taiwan Semi's Q3, AI Revenue Set To Triple: Analyst",https://www.benzinga.com/news/24/10/41388050/apples-3nm-push-boosts-taiwan-semis-q3-ai-revenue-set-to-triple-analyst
2024-10-17,10 Information Technology Stocks With Whale Alerts In Today's Session,https://www.benzinga.com/insights/options/24/10/41388081/10-information-technology-stocks-with-whale-alerts-in-todays-session
2024-10-17,"Meta's AI Open-Source Claims Draw Criticism, OSI Pushes For Transparency",https://www.benzinga.com/news/24/10/41388451/metas-ai-open-source-claims-draw-criticism-osi-pushes-for-transparency
2024-10-17,"Chipmakers Rally, Nvidia Smashes Records On TSMC Blowout Earnings, Gold Hits All-Time Highs: What's Driving Markets Thursday?",https://www.benzinga.com/markets/equities/24/10/41387939/chipmakers-rally-nvidia-smashes-records-on-tsmc-blowout-earnings-gold-hit-all-time-highs-whats-d
