date,news_content,url
2022-09-20,Introducing RTX Remix | GeForce News. ,https://news.google.com/read/CBMic0FVX3lxTE1mT3hMbExRZzR3NVRtbHRueWxlTVUtOWJ3R25XWXU1U2FTdm4ybUhKbWFrVG1ETDVCdHNwQ1R3aXJmTjNJVUZGejd4cFhyZ0Q0alZEUzZCQU4yeFgtVEYzc2dxX1pqM0ZUQkg0UjB5d1dxdHc?hl=en-US&gl=US&ceid=US%3Aen
2023-05-28,Introducing NVIDIA ACE For Games - Spark Life Into Virtual Characters With Generative AI. ,https://news.google.com/read/CBMiigFBVV95cUxQMVpFUlZSSzMwaFZtZS1aU0drQi1QYXlzVzFqclktQ3Vwai0ybklFMXlDbFlMMURwY1lpRy00TkR5cEV0UTBEWGRuZF91andYRndaSnhzNEEtLVgwT3dvc2sySkRBTjRKWHBuU1JsVGZmQm94WE04YXRJUHg2Si1zRWRTQS1XMlNwNEE?hl=en-US&gl=US&ceid=US%3Aen
2024-03-14,"DLSS 3.5 and Full Ray Tracing Coming To Black Myth: Wukong, NARAKA: BLADEPOINT and Portal with RTX; Star Wars™ Outlaws Launching With DLSS 3 and Ray Tracing. ",https://news.google.com/read/CBMinAFBVV95cUxQSDBQbDc5dUs3NUMtZUxfTC1ScXVWdDZBRllYbGhZcEJzTFc3QjczYVlUTzBMSFVMZkpETGh0OGlxWXV3cFRJdDYtVExXUk9yeDgyNGJuNFJWUEVKVmRob0IwUDkyQkk2MDhGUC11c01YT1hieEdSelpPcWVpSWk0VTRlc0pLakN0eUdhRE9IWWUySXdoWDFVOVZwT0Y?hl=en-US&gl=US&ceid=US%3Aen
2023-01-12,NVIDIA Broadcast 1.4 Adds Eye Contact and Vignette Effects With Virtual Background Enhancements | GeForce News. ,https://news.google.com/read/CBMigAFBVV95cUxNLVRYd1lDWXhlWWdyTU9vd0c5anJhRDV6SnFQb1dhd3daeW5KYlBBa3NTeExVcHByelJiR3ctYXpUZHZWOWtyalNOTmRQcDM3a1B6NXFnSzdQUFA0azMya2c3cTB5dzYtUGVxdG03ZjZ6eFhqU2lEV3RuZWt3bmp5RQ?hl=en-US&gl=US&ceid=US%3Aen
2023-02-28,Pixel Perfect: RTX Video Super Resolution Now Available for GeForce RTX 40 and 30 Series GPUs. ,https://news.google.com/read/CBMiaEFVX3lxTE1vTUZRTlJROElab3dpcmpBN1Q1SUszMVBaTVVEdmd4LUIyUlZOei1WVHpLSVJoYmozbmxnUW96OE0zUW5nd1Byd04tT2RQd01nWmFGZ2xKWUw5dng5VE5zS0Zkdm8tUXJX?hl=en-US&gl=US&ceid=US%3Aen
2024-02-12,"NVIDIA RTX 2000 Ada Generation GPU Brings Performance, Versatility for Next Era of AI-Accelerated Design and Visualization. ",https://news.google.com/read/CBMiVkFVX3lxTFBLa3p0dGFRSjJmaENTY3liUzQ3X0YzZFEzSWg5WFRNYWhUTWQ0VFNOWnljaHQzY0RwRFhNbk9WSkxvVlQ2dWV3ZXlqS3ZsbDJ0NGlFcDhR?hl=en-US&gl=US&ceid=US%3Aen
2020-04-16,NVIDIA RTX Voice: Setup Guide. ,https://news.google.com/read/CBMifkFVX3lxTFBlUllwZHhtVGlnYzViNHVyQTRzNHlOYnhlRjloUmg1Y1pvcnE1TmVUd2dBV2lPZ1ZqU0ZrZzJJb2lqYnVtOFBpOThVV0l4MUZybXZuWW9MdzJDNGxjb2psa0xXUXJ6c0dBUFFQVTdpNmRITVV3UUtVVUYtcUhWQQ?hl=en-US&gl=US&ceid=US%3Aen
2024-04-16,New NVIDIA RTX A400 and A1000 GPUs Enhance AI-Powered Design and Productivity Workflows. ,https://news.google.com/read/CBMiZkFVX3lxTE50NEh4REJKVmNUS1ZpMFVMVXFNanhVdC12Vk5oTjN5T09LVmwtc3pkb1FDZTBxM1E3ZG9ZZkU0VGZlSXg3TzNVbjdEZ0VLVlZGNXNnTGxWSEdlZjFTTUV5cWVRcGF3dw?hl=en-US&gl=US&ceid=US%3Aen
2024-01-22,NVIDIA RTX Remix Open Beta Available Now - Remaster The Classics With RTX. ,https://news.google.com/read/CBMijwFBVV95cUxQZ2U1VmtEU0RMZzJqMjNLQ1lDSENLQmJwRThvTkk2ekRpX084TVBRNE1Sa1g4U2w5LTZ1ZG9tbFV1YUd4ckk2azhRYjA1OFl4bEFWeTJkMEtsbEtYd2JJNkg1OUp2WlZEcXVtdkFIMGtGTGg0Zy1RODJFLWhYM1RQYVVNTFllUWt4aUswY1VOWQ?hl=en-US&gl=US&ceid=US%3Aen
2021-05-31,"NVIDIA DLSS & GeForce RTX: List Of All Games, Engines And Applications Featuring GeForce RTX-Powered Technology And Features. ",https://news.google.com/read/CBMifEFVX3lxTE1KZG1wdC1JaHdWT0p3VmJqUUVWMGo4VXgydHZMZWk5dXdmaU10QUxScG0yNGxScktBdzVPQXNoa2dWYTE0b0xxQURkZDFDbk5LMFlHdEJMQ3pfNG5hNFhJR2l2dkVNekh5dWktWFY5U2RRVi10QlA4UjMyNkQ?hl=en-US&gl=US&ceid=US%3Aen
2024-05-21,"New Performance Optimizations Supercharge NVIDIA RTX AI PCs for Gamers, Creators and Developers. ",https://news.google.com/read/CBMicEFVX3lxTE9JbzJ6NkRiMFJxXzRpamdZNTF2ZTdFTEYzX2ZfSWpwZWNMeEdIcmhlQm9iM3NzdmpCc0J5U2Nfc2x6RWhJNU5GLVBCbnIyTGdDUFRYQkx3d3ZuRTNWUmNqZVlFVXMxTHczeXlIdHVTdGw?hl=en-US&gl=US&ceid=US%3Aen
2023-08-08,SIGGRAPH Special Address: NVIDIA CEO Brings Generative AI to LA Show. ,https://news.google.com/read/CBMibEFVX3lxTFBjbEE5M3FkczBVRU9fbkFyRHh6eDFORmxQMDhvSHFEVmpYdDFGRzdkOTUtZk45Q05DYS1DS3lSU0lleTJvZnRZMUhKcE9KNDBMdUR0NnNrRUtUTk5ZSFBEMmdLVEUxdlRMMG5aNQ?hl=en-US&gl=US&ceid=US%3Aen
2022-01-04,NVIDIA Makes Free Version of Omniverse Available to Millions of Individual Creators and Artists Worldwide. ,https://news.google.com/read/CBMidkFVX3lxTE5Vbml2elFKbTV6NGFUWTFVMF9DamJCMXJhbHFqRUlNZ1RwM0pIRWxLUWJudmhVejMzdXRhVjNENUhSc1FCTGJsRWJGQTlCTUJqSGVKRHBZZ1ItNU5jWWlWSkxTV0RVMkZ5bWh4YXZyc3diZzVrZmc?hl=en-US&gl=US&ceid=US%3Aen
2024-01-08,Picture This: Getty Images Releases Generative AI By iStock Powered by NVIDIA AI Foundry. ,https://news.google.com/read/CBMickFVX3lxTE81ZGYwdUNZeENyZV8xOGFqNllvN0tMX0s3ZG56VXNwRFoyR2VNdGUxZ1czUVZUaHBJRzlwdlZ4ekZVTzMyQml6Ri04cWJWa1NhdnJPZGFSWVEtMk1HS3d2dFVUdzc4NXZsS2hGMy1BM3VoUQ?hl=en-US&gl=US&ceid=US%3Aen
2024-02-26,NVIDIA RTX 500 and 1000 Professional Ada Generation Laptop GPUs Drive AI-Enhanced Workflows From Anywhere. ,https://news.google.com/read/CBMiYEFVX3lxTE9OYXhTOW1aalJIOVpyYlhUMHFJdkNyeHl1VmdEM2tZc1NyMTRDZnF6QWVQUnJHYUstTXZrWnA0dmc4Wm1DQkNNOWJHenpDcy14cDdJZlB2RzVZeXpCVWZGRw?hl=en-US&gl=US&ceid=US%3Aen
2024-11-12,NVIDIA and SoftBank Corp. Accelerate Japan’s Journey to Global AI Powerhouse. ,https://news.google.com/read/CBMipwFBVV95cUxNVWx4MFVoTU9iNXJuOFpEaEtleHlzSy1JR3lCWWtodE1ETXpEb3QwWmFJMWwtM2JFUGdaVTh1eDVCWk5KUVh4RTNQb0ZSMjRnaWlvZU5tVFdZN0V3WTE4ZXVGMGREUTZ2a1B6U1dZTDNDMzZLUUdVbnhGZmZxRDVBcGFOcVV3Tmtic25YamlMdHpNUHl0dzg5OHJfMXd6REI1TE4zbU1xbw?hl=en-US&gl=US&ceid=US%3Aen
2024-03-18,NVIDIA Announces Project GR00T Foundation Model for Humanoid Robots and Major Isaac Robotics Platform Update. ,https://news.google.com/read/CBMigAFBVV95cUxNcXZtbDltOGs2NWJ3RldVZUxic0VJZklYcUo0dmxGb2xpQ0dxMWhXRVprWTFGcU9WbnhGUE1IcXcxVUQwX216ZjFyeTZMc1BfVWI1dEszcjJCb216Yk5tb1FrbzVYYWxJVGhRNmVzdUJRQmVfVTVZMGU5cHRMSkRwRg?hl=en-US&gl=US&ceid=US%3Aen
2023-11-21,NVIDIA Announces Financial Results for Third Quarter Fiscal 2024. ,https://news.google.com/read/CBMioAFBVV95cUxQc2VyekhqWFJLLXIxZWF0c0ZLS0pNTUNRblVyQlNhc3JydkZ5QmM3Z0F0cS1veHZIM1hqNHBjV3l2X1FUbkdBd0Z6ZkNqWlFNTzB2Q0RULThqZ21HanZEYVotWjBiUWR5OHRqTkY3QlMtenhMTE1YejVBM2JnVUdYYkFCV1ViY1J4X0JucW1KeVAxQTh2cUdxVU9CUHNULXFn?hl=en-US&gl=US&ceid=US%3Aen
2024-03-18,NVIDIA Announces Earth Climate Digital Twin. ,https://news.google.com/read/CBMihAFBVV95cUxNVXBici1JbFpDWGFaUDlFdmcta25EUkdjcnR4ak1IbWs4RzRERkNYalRuR0RIaHF6RFlJMWp0SnFiN2Rtel9qRTEyVVdha2dJRVlLUjVBQWFqLWY2ZUU2aXhvSnNISHl2RDJNM2VjT2ExZEx2LVJlOUptZUJnd3FtWV9IZWY?hl=en-US&gl=US&ceid=US%3Aen
2024-02-13,Say What? Chat With RTX Brings Custom Chatbot to NVIDIA RTX AI PCs. ,https://news.google.com/read/CBMiakFVX3lxTE51eFVEdUVKSXBhNGc5OEVjRW5NRk5PRFM1YU9kZ1ZYYjdXQlY4MzRUVkFhX0RKVzdCdFkzdkh0bFNLdUhmbFVqeGVHM0VOTHpQRno2N0txa3JmRWZrMlhFOXVoRHphUjVWQ0E?hl=en-US&gl=US&ceid=US%3Aen
2024-10-11,Game-Changer: How the World’s First GPU Leveled Up Gaming and Ignited the AI Era. ,https://news.google.com/read/CBMiX0FVX3lxTE4tRm1LZGRDMmxwSTBtTUp3SUVva1M3bXlqeXBWVDZEYVBUSE1pQ0ViQkJBS3FuUTFqXy1kdDZJVEZ2MThDdGhqNVhkR1o1V2QtTy1jMUVBZjlhOXQwbHJV?hl=en-US&gl=US&ceid=US%3Aen
2022-01-24,Meta Works with NVIDIA to Build Massive AI Research Supercomputer. ,https://news.google.com/read/CBMiZ0FVX3lxTE15V1pLY2xPZl91cXRETHh0cmV4czJmazdHTmg0ODFWWTVtNkw5cW4zXzBlbW9OTHhPMUlDLW9IZGNULXR6ZWFna2d2YVZfdXBaVDlNNjFfS0hUY0p4MkdXdDNQSE5yRDg?hl=en-US&gl=US&ceid=US%3Aen
2024-07-18,"Mistral AI and NVIDIA Unveil Mistral NeMo 12B, a Cutting-Edge Enterprise AI Model. ",https://news.google.com/read/CBMiZEFVX3lxTFBVZlZtZFdrd0JiWjNMQ2xzMjg5Z2xaS1ZkMmlmaDlNMXJlY3l0bWR3bmlMdGZVbTd1VEo0c2xsOXB3d190WUlvOV9hOUQwS1pFMHBmRjBjTkhuN2RrMlppWjRhRjI?hl=en-US&gl=US&ceid=US%3Aen
2023-05-28,NVIDIA Collaborates With SoftBank Corp. to Power SoftBank’s Next-Gen Data Centers Using Grace Hopper Superchip for Generative AI and 5G/6G. ,https://news.google.com/read/CBMigwFBVV95cUxNeS1VVE1GU2hHTkxiOHVvbEw5Sm13OHBEb0ZRT2xTbzh3UXNfLVNpWWNiT0ZPY0RYT2dSV2FmbldCbkl5RVNGbDJjSFY0dWlycy1JRzlzUFFRYUU0dnUwWkJIWWZFN1pwWnBFdTNCZDU4N1ZOQXA2N1Z6MzQ2Y3h1c3lrSQ?hl=en-US&gl=US&ceid=US%3Aen
2024-06-02,"NVIDIA Releases Digital Human Microservices, Paving Way for Future of Generative AI Avatars. ",https://news.google.com/read/CBMiiAFBVV95cUxOWW9IQ0g4Qm1MLW40TW4wYzVwSWxmZW8xaFM0MGpfejlKQngyY1Jyd3JSQUdkWFE0RkZBZURnN1B2aXJrZVVMazVjT2taaVNHbnVKal9GdTVGZ01XXzh4c091cTBjMEU0Wk42bVJMUzVsQ3N0dHYwWm1SamdxeS1wT3p1UjA3TlEt?hl=en-US&gl=US&ceid=US%3Aen
2023-08-22,NVIDIA Debuts AI-Enhanced Real-Time Ray Tracing for Games and Apps With New DLSS 3.5. ,https://news.google.com/read/CBMicEFVX3lxTE8wdXRzSG5yeC1tWUhCQUtvVHR2MWRlY2QwemlVV01nN1FueGp4V2s1NHNhTUMxYXpBWjh2MmVTUW02UlF2dVo0Y2RWcHBNSGotbkRDeGlTU3dQS2FHWHQzc1VDdmFBX2xvek8zQmxsbzg?hl=en-US&gl=US&ceid=US%3Aen
2024-03-19,NVIDIA Digital Human Technologies Bring AI Game Characters To Life. ,https://news.google.com/read/CBMipwFBVV95cUxNWVNCX2dySXBuUEFIazFTU3ZTR1JVRmhRSVRtc21oSzdiNkdJZDZRVGRiS2I1alRja2xoT2J4UGpIbE1tcDlleDBhWUtkQlN6MmF4aVgwanpWakM0U1BOdFpLd0REX3Z5Vkh3d2xIdmNGODA4SGhkUkJESTlIb2pkQlpDdUxuejBzVkJWWlNJNUx3bTkxQ3lnejcxeThHN3lPenEyNWlUSQ?hl=en-US&gl=US&ceid=US%3Aen
2023-03-21,"NVIDIA Launches DGX Cloud, Giving Every Enterprise Instant Access to AI Supercomputer From a Browser. ",https://news.google.com/read/CBMizwFBVV95cUxPWHhHR0VpSEhlai1VV2loUGExYzlwZzcyUFFSZjhNT3gxT2lXeDRlc1ZBT20ySlRZLUpyRnRpUG9OODUwdzVjdWsxT3B3YXNTb0NqazNtMkJrTDQ4QUxqZ09CdjluSlJkVzlpVWc1SzB5c0F0Vzl1ZUlDSFE4MFRNdG1OTGE2VHlzbC03ZXNGVmxBdWlpRFNsUDRJTGoyWUFHT0NyQVVrV285Uk1wMy1Oc1VnN1BnazE1ZF9rTVN1VzhkYVktOTMzQTJLeUptdFU?hl=en-US&gl=US&ceid=US%3Aen
2024-11-06,"NVIDIA Advances Robot Learning, Humanoid Development With New AI and Simulation Tools. ",https://news.google.com/read/CBMidEFVX3lxTFBtWWZ0MVRxVGlDOHFiTlNoV3lmVlplTmlERFkwenpkeVg3SV9vM0lraEF1emYtblVyOWFhWWtGQllNdEVrRWpPSkM3Ym4zZmlrMFYwWTg5Rnl4eHZ2QkZUYVg1WnJNMjhJdHB1RnA5QV9WY1lj?hl=en-US&gl=US&ceid=US%3Aen
2023-07-18,NVIDIA RTX IO GPU-Accelerated Storage Technology Debuts This Month In Portal: Prelude RTX and Ratchet & Clank: Rift Apart. ,https://news.google.com/read/CBMihwFBVV95cUxOdHpobHN4aGRhR2h5QnA4RUhNbnZHQXlzNFVPdHJIT2ZBOENxUXhDZlNkZ2dGRlJxLXdLSGYzZ3g3bnBGNVBtYy1nMjJiNmx1WWhtb0RNVks1QnhHWjAwRkpuUWZ0Q3hzUFBjY3FIYjZ6WUx0NGJnWVk5WXItdXptY2tqMWZZZjA?hl=en-US&gl=US&ceid=US%3Aen
2022-10-04,"Overwatch 2: GeForce RTX 40 Series GPUs with NVIDIA Reflex reach 360+ FPS, 1440p. ",https://news.google.com/read/CBMilAFBVV95cUxQb2NHRzlTOE9hSHlDendGeU5yMG5hdThiT050TE8xWEdXVWpHLWlTbmV0Q3RCVS1GRU84MXNVenIyMF9QeTBEZlNwc182dVRRUkp5dGgwLXFYcWNwM181Yl9PTHl0Q3RqTllYZUJCMWhVOG9mZFZZWGhYdzZqTkdzVGdfOURza3JLUWlCSjFud2JMVmtB?hl=en-US&gl=US&ceid=US%3Aen
2023-03-21,NVIDIA Brings Generative AI to World’s Enterprises With Cloud Services for Creating Large Language and Visual Models. ,https://news.google.com/read/CBMi5AFBVV95cUxPWVIxZXVfQTVUdmp2dzVJTUJJOExpRUVXUVhLNkhjVnFRLVUzNUJvZXNSYnBnN0hTa3lnZmJFREM5Rk50TmRRRGVGOTFKVmJuZDZtRHlDSnM5ZGVMZTNPSk44MGZENlpaajh4ak8wR2FNQ1U1b1dyWE4waUZIczhjbzlrNG9mOEI5UWVLYk1EalY4dDJlcW5DQ2dzTlhVbFF6Nk9Pcl8tUjRRYmZqd2tKZEJ0Umd2MjFYR3NMbGhjLUtHeEZ6T2Fqcm1nN2hFZUZjWHhEWmxPMnNsdmluellKOGM5SS0?hl=en-US&gl=US&ceid=US%3Aen
2024-06-02,NVIDIA Robotics Adopted by Industry Leaders for Development of Tens of Millions of AI-Powered Autonomous Machines. ,https://news.google.com/read/CBMikAFBVV95cUxOc1k0UUpuT096UWFPUy1FTkVBYmtCbGV2WE1Leml1SC1iTHRIXzZrVndhNE9PWktRSnR1SnR3eEZVTk41WlFfNG1ZTV9nY1l2NUYzdjhNbTdYY01aR1RfdlRhcmFOMGhxcEpsR0ZXbFNMekhLWlhib1N3ODlHSTlPeW1MV29vZzhOV1ZJTDFzcHY?hl=en-US&gl=US&ceid=US%3Aen
2023-05-18,"GeForce RTX 4060 Family Is Here: NVIDIA’s Revolutionary Ada Lovelace Architecture Comes to Core Gamers Everywhere, Starting at $299. ",https://news.google.com/read/CBMi9AFBVV95cUxQTnZVVnIzMlA3Vk90S1ZtRDRwcUIwSHR3Q19SMDV6YjVxeVVKYl96c0R3WXpjYW55bVpJY2VXbXZoM1UzREFBOG04NDRZN2ZSTUdkeFBkVmdoa0tVTTlaTGRQWFk1eHZodzY4SkwyR01wVGdhbkxWN3dmN2oybEZtajlieEFocVFXbVZzQ3g1c3VrYmZURHR3T001cUg0SHNGMXV1dU52QmkyWTRmb3Z2SVZiNS12bE5OMC1nbzRzVkdqX1F6RHA4TjNXTTE2R05TNmFBLXFVYzVPZmEzWVNVN21ILU84b3FUOHptdnJTd09INHU0?hl=en-US&gl=US&ceid=US%3Aen
2024-11-14,"Celebrate Half-Life 2’s 20th Anniversary: Custom GeForce RTX 4080 Giveaway, Tribute Video & New Look At Half-Life 2 RTX. ",https://news.google.com/read/CBMijAFBVV95cUxOMFR3NFdCZXpyMmhtVEdvSURrc2h6OGhtelB5VGVkNklTT1BWMmpjWXduS01nU0JwRDhRbG55OWk4Xy14eXZjWFZHVkJzUG9UNk1KX3NZa2JJWW80YVRUOTdMSGpYTEdyb3duTDVGcVVrZW84blRSM1otWG1uWnEtc3M5SEh1djZENkd3aA?hl=en-US&gl=US&ceid=US%3Aen
2024-04-18,Wide Open: NVIDIA Accelerates Inference on Meta Llama 3. ,https://news.google.com/read/CBMic0FVX3lxTE0zV1BKUjZmOFl2Wi1xRDVROWVPc3pnaWw3ODdtYjJ2T1pfS21KcFJPV3ZHNkw2VmNHNUlLY0Z5Y1RIVlQxYnF4T0ptZnRxVlNxLUhKVFE5S3VsbnVhb1EyeWpEVmpvd0ppUDV0eUhXSVBzYWc?hl=en-US&gl=US&ceid=US%3Aen
2024-10-02,"Nvidia, Palantir, Clover Health, Joby Aviation, Tesla: Why These 5 Stocks Are On Investors' Radars Today",https://www.benzinga.com/markets/equities/24/10/41156759/nvidia-palantir-clover-health-joby-aviation-tesla-why-these-5-stocks-are-on-investors-radars-tod
2024-10-02,"Nvidia CEO Jensen Huang Says Demand For Next-Gen Blackwell GPU Platform Insane: 'Everyone Wants To Have The Most, And Everyone Wants To Be First'",https://www.benzinga.com/news/24/10/41156900/nvidia-ceo-jensen-huang-says-demand-for-next-gen-blackwell-gpu-platform-insane-everyone-wants-to-hav
2024-10-03,Biden Signs Law To Exempt Certain US Chipmaking Facilities From Federal Environmental Reviews Under CHIPS Act,https://www.benzinga.com/markets/equities/24/10/41158922/biden-signs-law-to-exempt-certain-us-chipmaking-facilities-from-federal-environmental-reviews-un
2024-10-03,US Stocks Staring At Another Weak Open As Traders Await Key Jobs Report; Sentiment Wavers As Oil Extends Surge Amid Middle East Tensions,https://www.benzinga.com/news/earnings/24/10/41161081/us-stocks-staring-at-another-weak-open-as-traders-await-key-jobs-report-sentiment-wavers-as-oil-ext
2024-10-03,Market-Moving News for October 3rd,https://www.benzinga.com/trading-ideas/movers/24/10/41162453/market-moving-news-for-october-3rd
2024-10-03,What's Going On With Taiwan Semiconductor Sock On Thursday?,https://www.benzinga.com/news/24/10/41163500/whats-going-on-with-taiwan-semiconductor-sock-on-thursday
2024-10-03,"Top 10 Trending Stocks On WallStreetBets As Of October 3, 2024 (Via Swaggy Stocks)",https://www.benzinga.com/trading-ideas/24/10/41164469/top-10-trending-stocks-on-wallstreetbets-as-of-october-3-2024-via-swaggy-stocks
2024-10-03,"'OpenAI Gets $4 Billion Revolving Credit Line, Giving It More Than $10 Billion In Liquidity' - CNBC",https://www.benzinga.com/news/24/10/41165976/openai-gets-4-billion-revolving-credit-line-giving-it-more-than-10-billion-in-liquidity-cnbc
2024-10-03,"Market Clubhouse Morning Memo - October 2nd, 2024 (Trade Strategy For SPY, QQQ, AAPL, MSFT, NVDA, GOOGL, META And TSLA)",https://www.benzinga.com/markets/24/10/41166735/market-clubhouse-morning-memo-october-2nd-2024-trade-strategy-for-spy-qqq-aapl-msft-nvda-googl-meta
2024-10-03,What's Going On With Nvidia Stock On Thursday?,https://www.benzinga.com/news/24/10/41168777/whats-going-on-with-nvidia-stock-on-thursday
2024-10-03,Nvidia Shares Are Moving Higher: What's Happening?,https://www.benzinga.com/news/large-cap/24/10/41169979/whats-going-on-with-nvidia-stock
2024-10-03,"Investors Suffering Cognitive Dissonance, Insane Demand For Nvidia Chips, Anxiety Builds About Israel And Iran",https://www.benzinga.com/general/market-summary/24/10/41168579/investors-suffering-cognitive-dissonance-insane-demand-for-nvidia-chips-anxiety-builds-abo
2024-10-03,10 Information Technology Stocks Whale Activity In Today's Session,https://www.benzinga.com/insights/options/24/10/41171118/10-information-technology-stocks-whale-activity-in-todays-session
2024-10-03,OpenAI's Latest 'Eye-Popping' Valuation Ignites Analyst Expectations For 'Tidal Wave' Of AI Spending,https://www.benzinga.com/analyst-ratings/analyst-color/24/10/41175197/openais-latest-eye-popping-valuation-ignites-analyst-expectations-for-tidal-wave-of
2024-10-03,OpenAI Secures $4B Credit Line To Supercharge AI Ambitions And Expand Nvidia-Powered Infrastructure: 'Provides Flexibility To Seize Future Growth Opportunities',https://www.benzinga.com/news/24/10/41178039/openai-secures-4b-credit-line-to-supercharge-ai-ambitions-and-expand-nvidia-powered-infrastructure-p
2024-10-04,"Nvidia's Troubles Mount As DOJ, SEC Throw Their Weight Behind Class Action Lawsuit Alleging AI Chip Giant Misrepresented Crypto Revenue",https://www.benzinga.com/markets/cryptocurrency/24/10/41181062/nvidias-troubles-mount-as-doj-sec-throw-their-weight-behind-class-action-lawsuit-alleging-
2024-10-04,SoftBank's Masayoshi Son Predicts Artificial Superintelligence Within A Decade After Testing OpenAI's 'Strawberry' Models,https://www.benzinga.com/news/24/10/41181374/softbanks-masayoshi-son-predicts-artificial-superintelligence-within-a-decade-after-testing-openais
2024-10-04,US Stocks On Edge As Traders Brace For Crucial Jobs Report: Why This Fund Manager Says AI Stocks Just Received Big Boost,https://www.benzinga.com/news/earnings/24/10/41181506/us-stocks-on-edge-as-traders-brace-for-crucial-jobs-report-why-this-fund-manager-says-ai-stocks-jus
2024-10-04,What's Going On With Taiwan Semiconductor Stock On Friday?,https://www.benzinga.com/news/24/10/41182945/whats-going-on-with-taiwan-semiconductor-stock-on-friday
2024-10-04,Mark Zuckerberg Bulldozes Past Jeff Bezos To Become World's 2nd Richest Person As Meta Stock Soars: Is Musk's Top Spot In Jeopardy?,https://www.benzinga.com/markets/equities/24/10/41179608/mark-zuckerberg-bulldozes-past-jeff-bezos-to-become-worlds-2nd-richest-person-as-meta-stock-soar
2024-10-04,Nvidia's Top Brass Unloaded Significant Stock In 2024 Amid AI Spending and Chip Delays,https://www.benzinga.com/news/24/10/41183612/nvidias-top-brass-unloaded-significant-stock-in-2024-amid-ai-spending-and-chip-delays
2024-10-04,"Top 10 Trending Stocks On WallStreetBets As Of October 4, 2024 (Via Swaggy Stocks)",https://www.benzinga.com/trading-ideas/24/10/41184970/top-10-trending-stocks-on-wallstreetbets-as-of-october-4-2024-via-swaggy-stocks
2024-10-04,"Nvidia, Trade Desk And A Financial Stock On CNBC's 'Final Trades'",https://www.benzinga.com/trading-ideas/long-ideas/24/10/41185042/nvidia-trade-desk-and-a-financial-stock-on-cnbcs-final-trades
2024-10-04,ARM Stock: SoftBank's AI Goals Vs. Bearish Market Trends,https://www.benzinga.com/trading-ideas/technicals/24/10/41185402/arm-stock-softbanks-ai-goals-vs-bearish-market-trends
2024-10-04,"Market Clubhouse Morning Memo - October 4th, 2024 (Trade Strategy For SPY, QQQ, AAPL, MSFT, NVDA, GOOGL, META And TSLA)",https://www.benzinga.com/trading-ideas/24/10/41186762/market-clubhouse-morning-memo-october-4th-2024-trade-strategy-for-spy-qqq-aapl-msft-nvda-googl-meta
2024-10-04,"AI Stocks Ripping, Barn Burner Jobs Report - Could Powell Be Wrong?",https://www.benzinga.com/general/market-summary/24/10/41188370/ai-stocks-ripping-barn-burner-jobs-report-could-powell-be-wrong
2024-10-04,10 Information Technology Stocks Whale Activity In Today's Session,https://www.benzinga.com/insights/options/24/10/41190058/10-information-technology-stocks-whale-activity-in-todays-session
2024-10-04,"Labor Market Surprises With Strength, Energy Stocks Rally On Israel-Iran Tensions, Chinese Tech Giants Rebound: This Week In The Markets",https://www.benzinga.com/markets/asia/24/10/41192510/labor-market-surprises-with-strength-energy-stocks-rally-on-israel-iran-tensions-chinese-tech-giants
2024-10-05,Michael Saylor Once Said 'Bitcoin's Days Are Numbered.' Now He Holds More Than A Billion Worth Of King Crypto: Here's What Changed For One Of Crypto's Biggest Advocates,https://www.benzinga.com/markets/cryptocurrency/24/10/41195876/michael-saylor-once-said-bitcoins-days-are-numbered-now-he-holds-more-than-a-billion-worth
2024-10-05,"Benzinga Bulls And Bears: Nvidia, Apple, Amazon, Spirit Airlines — And Dogecoin Drops But Whale Activity Remains High",https://www.benzinga.com/markets/cryptocurrency/24/10/41195980/benzinga-bulls-and-bears-nvidia-apple-amazon-spirit-airlines-and-dogecoin-drops-but-whale-
2024-10-06,"Consumer Tech News (Sept 30-Oct 4): Latest Windows 11 Update Causing Trouble, Apple Accused Of Compelling Employees To Sign Illegal Agreements & More",https://www.benzinga.com/news/24/10/41197781/consumer-tech-news-sept-30-oct-4-latest-windows-11-update-causing-trouble-apple-accused-of-compellin
2024-10-06,"Nvidia's Blackwell GPU, Musk's OpenAI Accusations, Tesla's Robotaxi Event, And More: This Week In AI",https://www.benzinga.com/news/24/10/41197944/nvidias-blackwell-gpu-musks-openai-accusations-teslas-robotaxi-event-and-more-this-week-in-ai
2024-10-07,"Schwab Trading Activity Falls In September Despite Market Strength: Nvidia, Palantir Among Most Sought-After Stocks But These 5 Fell Out Of Favor",https://www.benzinga.com/markets/equities/24/10/41200138/schwab-trading-activity-falls-in-september-despite-market-strength-nvidia-palantir-among-most-so
2024-10-07,Wall Street Set To Start New Week Sharply Lower As Traders Brace For Key Economic Data And Fed Minutes: Why Strategist Sees Market Consolidating In Near Term,https://www.benzinga.com/news/earnings/24/10/41203264/wall-street-set-to-start-new-week-sharply-lower-as-traders-brace-for-key-economic-data-and-fed-minu
2024-10-07,Nvidia's GPU Sales at Risk As China Pushes Local AI Chips in Retaliation,https://www.benzinga.com/government/24/10/41204521/nvidias-gpu-sales-at-risk-as-china-pushes-local-ai-chips-in-retaliation
2024-10-07,"What's Going On With US Listed Chinese Stocks Alibaba, JD, Nio, Li Auto XPeng on Monday?",https://www.benzinga.com/government/24/10/41206255/whats-going-on-with-us-listed-chinese-stocks-alibaba-jd-nio-li-auto-xpeng-on-monday
2024-10-07,"Top 10 Trending Stocks On WallStreetBets As Of October 7, 2024 (Via Swaggy Stocks)",https://www.benzinga.com/wiim/24/10/41207290/top-10-trending-stocks-on-wallstreetbets-as-of-october-7-2024-via-swaggy-stocks
2024-10-07,"S&P 500 Could Reach 6,300 In 12 Months, Says Goldman Sachs, Driven By 'Strong AI Demand' And 'Margin Expansion'",https://www.benzinga.com/markets/equities/24/10/41207490/s-p-500-could-reach-6-300-in-12-months-says-goldman-sachs-driven-by-strong-ai-demand-and-margin-
2024-10-07,"Market Clubhouse Morning Memo - October 7th, 2024 (Trade Strategy For SPY, QQQ, AAPL, MSFT, NVDA, GOOGL, META And TSLA)",https://www.benzinga.com/markets/24/10/41208690/market-clubhouse-morning-memo-october-7th-2024-trade-strategy-for-spy-qqq-aapl-msft-nvda-googl-meta
2024-10-07,NVIDIA's Options: A Look at What the Big Money is Thinking,https://www.benzinga.com/insights/options/24/10/41209732/nvidias-options-a-look-at-what-the-big-money-is-thinking
2024-10-07,Stock Market Investors Nervous About Potential Israeli Attack On Iran,https://www.benzinga.com/general/market-summary/24/10/41210344/stock-market-investors-nervous-about-potential-israeli-attack-on-iran
2024-10-07,What's Going On With Super Micro Computer Stock On Monday?,https://www.benzinga.com/news/24/10/41211823/whats-going-on-with-super-micro-computer-stock-on-monday
2024-10-07,"Bitcoin, Ethereum, And AI: A Conversation With The CEO Of Bit Digital",https://www.benzinga.com/general/24/10/41213262/bitcoin-ethereum-and-ai-a-conversation-with-the-ceo-of-bit-digital
2024-10-07,10 Information Technology Stocks With Whale Alerts In Today's Session,https://www.benzinga.com/insights/options/24/10/41213339/10-information-technology-stocks-with-whale-alerts-in-todays-session
2024-10-07,"Tradepulse Power Inflow Alert: NVDL, Graniteshares 2X Long NVDA Daily ETF Rises 6% After Signal",https://www.benzinga.com/signals/24/10/41219215/tradepulse-power-inflow-alert-nvdl-graniteshares-2x-long-nvda-daily-etf-rises-6-after-signal
2024-10-07,Samsung Warns Of Q3 Profit Drop Amid Shipment Delays Of AI Chip Approved By Nvidia,https://www.benzinga.com/markets/equities/24/10/41220202/samsung-warns-of-q3-profit-drop-amid-shipment-delays-of-ai-chip-approved-by-nvidia
2024-10-07,"Alibaba, Nvidia, Riot Platforms, Celsius Holdings, Tesla: Why These 5 Stocks Are On Investors' Radars Today",https://www.benzinga.com/markets/equities/24/10/41220313/alibaba-nvidia-riot-platforms-celsius-holdings-tesla-why-these-5-stocks-are-on-investors-radars-
2024-10-08,Apple Supplier Foxconn To Build World's Largest Nvidia Superchip Factory Amid Soaring AI Demand,https://www.benzinga.com/markets/equities/24/10/41221276/apple-supplier-foxconn-to-build-worlds-largest-nvidia-superchip-factory-amid-soaring-ai-demand
2024-10-08,"US Stocks Poised To Bounce Back As Bond Yields Dip, Oil Prices Slide, PepsiCo Pulls Back: Set-up 'Quite Positive' For Equities, Says Economist",https://www.benzinga.com/news/earnings/24/10/41224832/us-stocks-poised-to-bounce-back-as-bond-yields-dip-oil-prices-slide-pepsico-pulls-back-set-up-quite
2024-10-08,Next-Gen Nvidia GPUs Could Be Revealed at CES 2025 - What You Need to Know,https://www.benzinga.com/news/24/10/41227135/next-gen-nvidia-gpus-could-be-revealed-at-ces-2025-what-you-need-to-know
2024-10-08,"Top 10 Trending Stocks On WallStreetBets As Of October 8, 2024 (Via Swaggy Stocks)",https://www.benzinga.com/trading-ideas/24/10/41228564/top-10-trending-stocks-on-wallstreetbets-as-of-october-8-2024-via-swaggy-stocks
2024-10-08,Intel Vs. Oracle: Can Apollo's Rescue Plan Beat Oracle's AI Cloud Domination?,https://www.benzinga.com/analyst-ratings/analyst-color/24/10/41228871/intel-vs-oracle-can-apollos-rescue-plan-beat-oracles-ai-cloud-domination
2024-10-08,Top Wall Street Forecasters Revamp Applied Digital Price Expectations Ahead Of Q1 Earnings,https://www.benzinga.com/news/earnings/24/10/41230092/top-wall-street-forecasters-revamp-applied-digital-price-expectations-ahead-of-q1-earnings
2024-10-08,"Market Clubhouse Morning Memo - October 8th, 2024 (Trade Strategy For SPY, QQQ, AAPL, MSFT, NVDA, GOOGL, META And TSLA)",https://www.benzinga.com/markets/24/10/41230955/market-clubhouse-morning-memo-october-8th-2024-trade-strategy-for-spy-qqq-aapl-msft-nvda-googl-meta
