title,date,media,url,desc
Where Will Nvidia Stock Be in 3 Years?,1 hour ago,The Motley Fool,https://www.fool.com/investing/2025/01/04/where-will-nvidia-stock-be-in-3-years/&ved=2ahUKEwjHnKm0o92KAxU3m4kEHTRVM9AQxfQBegQIAhAC&usg=AOvVaw2ls2Xh5_O_Q9S6EOuXDj1K,"Nvidia's huge addressable market opportunity indicates that there is room for more upside, even after the terrific gains it has delivered in the past three..."
Dow Jones Futures: Nvidia Led The Market Comeback. CEO Jensen Huang Looms.,2 hours ago,Investor's Business Daily,https://www.investors.com/market-trend/stock-market-today/dow-jones-futures-nvidia-ceo-jensen-huang/&ved=2ahUKEwjHnKm0o92KAxU3m4kEHTRVM9AQxfQBegQICRAC&usg=AOvVaw2BJWgxN-Xgk7VvjWq1bn2c,"Dow Jones futures: Many leaders flashed buy signals in Friday's market rally, including Nvidia. CEO Jensen Huang gives a key speech Monday."
"NVIDIA Giving Away CEO-Signed GeForce GTX 1080 Ti GPU, The Best “Ti” of All",3 hours ago,Wccftech,https://wccftech.com/nvidia-geforce-gtx-1080-ti-giveaway/&ved=2ahUKEwjHnKm0o92KAxU3m4kEHTRVM9AQxfQBegQIBhAC&usg=AOvVaw2bGQCKACYgfcqMPt_fV347,"Yet another giveaway has started & this time, it's none other than one of the best high-end GPUs of its time, the NVIDIA GeForce GTX 1080 Ti."
Mag 7? More like 'Mag 1' as Nvidia dominates the megacap club in 2024,5 hours ago,Seeking Alpha,https://seekingalpha.com/news/4392514-mag-7-more-like-mag-1-as-nvidia-dominates-the-megacap-club-in-2024&ved=2ahUKEwjHnKm0o92KAxU3m4kEHTRVM9AQxfQBegQIBRAC&usg=AOvVaw1xDvK1kAF0VYS4kgmFVBGE,"The ""Magnificent Seven"" club of megacap technology stocks played a massive role in Wall Street's banner 2024, with the group on average seeing an advance of..."
"Trillion-dollar tech company emerges as key partner to help Google, Meta and other hyperscalers build an Nvidia-free AI future",5 hours ago,TechRadar,https://www.techradar.com/pro/trillion-dollar-tech-company-emerges-as-key-partner-to-help-google-meta-and-other-hyperscalers-build-an-nvidia-free-ai-future&ved=2ahUKEwjHnKm0o92KAxU3m4kEHTRVM9AQxfQBegQIARAC&usg=AOvVaw3zQbUiYkI4WrceFESvX8zA,"Hyperscalers such as Google, Meta, and TikTok owner ByteDance are increasingly seeking to diversify their AI hardware supply chains, reducing their reliance..."
Nvidia Tops Semiconductor Ownership Among U.S. Fund Managers: BofA Report,6 hours ago,GuruFocus,https://www.gurufocus.com/news/2645123/nvidia-tops-semiconductor-ownership-among-us-fund-managers-bofa-report&ved=2ahUKEwjHnKm0o92KAxU3m4kEHTRVM9AQxfQBegQIABAC&usg=AOvVaw27aFGrjUK547Izfe1i02Mu,"With 72% ownership as of December 2024, Nvidia (NVDA, Financials) still rules as the most often held semiconductor stock among active U.S. fund managers."
"Analysts make Nvidia, AMD predictions ahead of Consumer Electronics Show",9 hours ago,TheStreet,https://www.thestreet.com/investing/stocks/analysts-make-nvidia-amd-predictions-ahead-of-consumer-electronics-show&ved=2ahUKEwjHnKm0o92KAxU3m4kEHTRVM9AQxfQBegQICBAC&usg=AOvVaw1QcZ2Ka43Jxk1BO0Cp8FR5,Wall Street veterans offer forecasts before the big tech event in Las Vegas.
Best Dow Jones Stocks To Watch In January 2025,0 hours ago,Investor's Business Daily,https://www.investors.com/research/dow-jones-stocks-january-2025/&ved=2ahUKEwjHnKm0o92KAxU3m4kEHTRVM9AQxfQBegQIBxAC&usg=AOvVaw2l5em4GsP9eYycJOWps_Af,"The best Dow Jones stocks to buy and watch in January 2025 include Amazon, Apple and Nvidia stock in today's stock market."
Magnificent Seven Stocks To Buy And Watch,0 hours ago,Investor's Business Daily,https://www.investors.com/research/magnificent-seven-stocks-january-2025/&ved=2ahUKEwjHnKm0o92KAxU3m4kEHTRVM9AQxfQBegQIBBAC&usg=AOvVaw3yeFTnfQxniAZEY0qYpbgp,"Magnificent Seven Stocks: Nvidia Surges Above Key Level; Tesla Rebounds, Apple Extends Sell-Off ... Dubbed the Magnificent Seven stocks, Apple, Microsoft, Google..."
Is Advanced Micro Devices (AMD) Stock a Buy Now?,1 hours ago,Yahoo Finance,https://finance.yahoo.com/news/advanced-micro-devices-amd-stock-133000829.html&ved=2ahUKEwjHnKm0o92KAxU3m4kEHTRVM9AQxfQBegQIAxAC&usg=AOvVaw23uEJsIzPbZvX49isZXTdn,The stock market can sometimes feel like a popularity contest. Investors have flocked to Nvidia because it's the dominant supplier of the data center chips...
NVIDIA App Officially Released: Download The Essential Companion For PC Gamers & Creators | GeForce News,Nov 12,NVIDIA Daily News Report,https://news.google.com/read/CBMigAFBVV95cUxOaFREOWJ6Tm44UTZDd1VmTmJ5U0p4MXVJXzQ4bEY1LWR1MnQxalBWeUZyV1pQeFJxM3R3UkJialdYZzJUdHNpdXRpQmxEUElUXzEzZnBWaS1jR25IYnpvYmIyc0djU0NPQjZXdUF3UVJZa1o5Z0lSdnhtWlRQUjBOWA?hl=en-US&gl=US&ceid=US%3Aen,
"GeForce Is Made for Gaming, CMP Is Made to Mine","Feb 18, 2021",NVIDIA Blog,https://news.google.com/read/CBMiVEFVX3lxTE5tdTEtczROTHBIU1NaZ3VhT1hBd0RhWThHRkRUdHJmWk5KVzRpcHptY20yclRnR3pXcldxcm1QTmlyUFhrcV9jRTI4YmU4NUVmcV8xNA?hl=en-US&gl=US&ceid=US%3Aen,
NVIDIA Blackwell Platform Arrives to Power a New Era of Computing,"Mar 18, 2024",NVIDIA Blog,https://news.google.com/read/CBMiogFBVV95cUxOczF5bzhxRFgzM1lwaC1reFBBdV81VzFpM1JocmpWRVBFMlM2MHZRdGhCVEk5YzBkRXR4NTlWSk5WN29qVXowOWtzeG5lX01ma1RpU2tRU3QzMGFUQmpLelBLMEtlSEc0X3VPU3VneGRVclhxSHRZc2lYLXpQbjJja2kyTVZWZDJ0X2RQUVVPblZLbFMxX2U2RGNGNmZMT3RMRXc?hl=en-US&gl=US&ceid=US%3Aen,
"NVIDIA Supercharges Hopper, the World’s Leading AI Computing Platform","Nov 13, 2023",NVIDIA Blog,https://news.google.com/read/CBMipAFBVV95cUxPendCQ3B1THR2ejgxVFBiT2NfZ3NkeVdOTVlBeVRlWEdDVmloeXE3MW5RVWdIeTFjOW1TMExzSnRVTE1YazBOMmVYZ2hIVEYwQktRZzdaZXVkYXczLVZEX1B1YkJfYW9SYm11RHUxLVdRVXEtdUF1VF9aR3ZmSTd0cEhQVnFzZTlkZzlKSEFnZXg1TklYNkUwbDJvQWhiMEtqTi1NWQ?hl=en-US&gl=US&ceid=US%3Aen,
"NVIDIA Delivers Quantum Leap in Performance, Introduces New Era of Neural Rendering With GeForce RTX 40 Series","Sep 20, 2022",NVIDIA Blog,https://news.google.com/read/CBMi3AFBVV95cUxPbTdmeXVlNXBYU0RlSVdDNGotdV9iNVFEd2ZSSE8xOGt1QjdFc21iRXVQWGZTN1ZCaXZfS084Q0NVMEV5VzQxbElKU0pxR3BiOEZlVG1MbFZEaWhrRm13d1ZDR0NKV1VXaDJoTlhZc2VNOGpPeEpvRjJiZnIteVJTdFhxdEs0di1DM29hZXhvV2lVUmtmRFprUFJOcmYySE1VbHo2ejJmZHNRLUIxQ25pYjVhY2tvbHJ5RThtRWVEcmpVRVRfc0NLanNKWnlqOS12U1BRUUtyOWZtdm40?hl=en-US&gl=US&ceid=US%3Aen,
Unlaunching The 12GB 4080,"Oct 14, 2022",NVIDIA Daily News Report,https://news.google.com/read/CBMibkFVX3lxTE5VcDVjQXVrRDBmbXRtZkd2Yl9rWHl2eTJ5cGFfQ3FFYmJwaVp6cTVJMXBaemdHdmZKUkFOT25wR3NheXBEaVpkQlhpdWlHLUc2VFgyU0t3OC03ZW5DanhqRHJtTnF3WVhrbDRsZ3FB?hl=en-US&gl=US&ceid=US%3Aen,
NVIDIA DLSS 2.0: A Big Leap In AI Rendering | GeForce News | NVIDIA,"Mar 23, 2020",NVIDIA Daily News Report,https://news.google.com/read/CBMijgFBVV95cUxOazdDa2preElCZlJjTVQ2eW1FY1ItR0NjSktIY2lQRXNPZnR0UmcweDNQcW54UHF6b194NzZmOUFpY1hUTU1Ea0ZZOENBaEpCQ1BXekFDRnAzdjNBbzFlSU9WNElMN0JKU2NwZlY0NWFtNklSYW5oVS1iUUtsVXRqSGRDTzg3NmkzeUFkWFBR?hl=en-US&gl=US&ceid=US%3Aen,
NVIDIA Announces Financial Results for Third Quarter Fiscal 2025,Nov 20,NVIDIA Blog,https://news.google.com/read/CBMioAFBVV95cUxORVRTS0xyVXRjd2h5M1VLZ3B1aWpaVkd6WWtWR2dNcjNMQ1hzaTdLZ1B1OVJkcjFQWm5wcXdnc3hTU1dGUVJFMUpOMXAxZFFxNFZqcEhRbHcxTGxfVXU5Um5FM29CaGtDMlppMVZWYmJ5NjBOT0MxSTNQb0lPSFJ1TzNyU1RaZFMxRU45RTNrRTZnNUZhLVgtODI0d1BJaEdI?hl=en-US&gl=US&ceid=US%3Aen,
Build a Custom LLM with ChatRTX,"Mar 18, 2024",NVIDIA Daily News Report,https://news.google.com/read/CBMiW0FVX3lxTE1meWJ4dGpuTjBBNmlXWXd5anZ1ckdibE81VDU2WWlFTnhGZmlOb0xfXzNGRmpXVS1LbHdfUXdvcDBtTkZJbTlhNjZzWDhHY0p0TmpQZFlkZk9iM1U?hl=en-US&gl=US&ceid=US%3Aen,
NVIDIA Announces Financial Results for Fourth Quarter and Fiscal 2024,"Feb 21, 2024",NVIDIA Blog,https://news.google.com/read/CBMipwFBVV95cUxOUFBYRExUUVJUbDhOSkR6WVVJT2RXZTd0MmszWm9hLTNYR0xlRmw1STlrMnFwMUlWNWdjZzRfWTRRZEtjOXk2WnRNZU9DU080elVUdzlWLWxTT1hvQVplNnVvX1phWUgzWldfc2xoSmEyZmdHakg1X240RzNrWEJ4MkN4eDBmVGZVTmN0UThBT0JZUGhHaG4yNzgzU3RuWmFCd280RzlZTQ?hl=en-US&gl=US&ceid=US%3Aen,
NVIDIA Unveils Its Most Affordable Generative AI Supercomputer,Dec 17,NVIDIA Blog,https://news.google.com/read/CBMic0FVX3lxTE5tTGlKLVU0akd5emRXQ3oxRC10UEJ2SjJLN2tkUUh6cHM4SWljTS1YRGluc1dnSXdLdGFBVFd5WlpFOUU4OVZQQU9DaTBfdXpIb0ZvOTRLNExIUWltdS1WZUNGbzJUU3NLcFZtbDY0OWRjVnM?hl=en-US&gl=US&ceid=US%3Aen,
"NVIDIA App Beta Adds G-SYNC Controls, RTX HDR Multi-Monitor Support & More | GeForce News",Oct 1,NVIDIA Daily News Report,https://news.google.com/read/CBMipgFBVV95cUxOQnhhS2R4cVo5Q1FGMkViaDFpeTdzVXlrVGNySlJxYnBMeVFLSEpkekUzcjNzUnpiZElJZlNkUi1NVEQwcWdWT1N1dUM2NlZQbFVETkF5LVlaU3ZoMWFZNjEwdmdyOXpuSVM0UWlJT2lFbGNpcnkyNEdEb0hUV1l2TVBtX2tiRV9XZnJ3VTIwaDNBbnpsT1dFTlN2SE1NOVp4WEdrWTln?hl=en-US&gl=US&ceid=US%3Aen,
What Is the Metaverse?,"Aug 10, 2021",NVIDIA Blog,https://news.google.com/read/CBMiYkFVX3lxTFBCaFU1ZTV0REhfRTFkTHdENUM3cUhkaGJoQnFJclNWSnVNb0JjQzV2MGNHc3FDY2QyV05vbzFsa1lJVjUxdWxEaFNGSHY4dDJIR2JkUzZuQ01uLVJ0MkhmSFdn?hl=en-US&gl=US&ceid=US%3Aen,
Introducing NVIDIA DLSS 3 | GeForce News,"Sep 20, 2022",NVIDIA Daily News Report,https://news.google.com/read/CBMikAFBVV95cUxPWkdtVWNxSXhWZWVXVmhpdzJsZXFXN3BtTTdhZFdMenl4NVFfMWxLRU0tXzgwMW15NzA0SlYwNXZrd2Jyd3h4ZlpZQnhPTDVGY3lUU1Rib1hMelRaV1ZtUDhyUmowVnoyS01yQjAyMWJabGNmekhPVi0tdjl1RUNMQTNsU3RWRW9FTmxocmpuUzE?hl=en-US&gl=US&ceid=US%3Aen,
NVIDIA Announces Financial Results for First Quarter Fiscal 2022,"May 26, 2021",NVIDIA Blog,https://news.google.com/read/CBMioAFBVV95cUxOOUtKb0pmZzZBUHpkRm5GS0NoNVNvWXJ1RFR2blRXRXlHelVVUHMtd3VSdzdHa1hOR05EQVQ0WWt3bkt2YV96Yl9jR0hRYklYM1ZhRERGeXJaYzRSV2ZxUGVzYzdDd1RPNlBfNGx5NWhIRnIwSTUyd2FkeVJ5c2VjeFE5ckxqWVM0Zmw2Q1R6MERVRC1BeFdpWDRKZ19rSUN0?hl=en-US&gl=US&ceid=US%3Aen,
NVIDIA Brings RTX 4080 to GeForce NOW,"Jan 3, 2023",NVIDIA Blog,https://news.google.com/read/CBMifEFVX3lxTE5IQjB4d05JYlg1Q1Q2eGN6V1RmXzNHaHBYcllwV3NxeHJpSTFYbXU5ZnlEUXJuZU5neVJvY1JYRzBpZkMwNjBJZ2ZVV2F3R2x5T0RLdlNwcVEzWEFVNlkwNXdhR3l0WnlDajl0enF6ekplTGstV0tRUHVPUkk?hl=en-US&gl=US&ceid=US%3Aen,
Test Drive The New NVIDIA App Beta: The Essential Companion For PC Gamers & Creators,"Feb 22, 2024",NVIDIA Daily News Report,https://news.google.com/read/CBMidkFVX3lxTFBYNFhVNjJpSVpPZUx2V3VLM05TWDdEa2hpclhiY2p4bVpZcndfMmpwdEJ3MkVORWxjTjlVTHBSLWRWRGE5TFk2MEZzY1Rzbjl3Y1RZNzZMOUNBRmt1ejgwUFZCVzFJTlFVOVE1amdpVDlscUYzSWc?hl=en-US&gl=US&ceid=US%3Aen,
Widescreen Wonder: Las Vegas Sphere Delivers Dazzling Displays,Jul 9,NVIDIA Blog,https://news.google.com/read/CBMiW0FVX3lxTE9TSEN4S2xES2p6MEE4VzNnUjlySzR4WXoxVmwxdEhOOFVJUjBBdkdkZzliVWgwdl9FRVRJRWRiMmNjU1ZRM2puVjRqS1FWT1EtcDY5Yk5jYVlPWXc?hl=en-US&gl=US&ceid=US%3Aen,
God of War NVIDIA DLSS & Reflex Game Ready Driver Released - Download and Install For The Definitive Experience,"Jan 14, 2022",NVIDIA Daily News Report,https://news.google.com/read/CBMie0FVX3lxTE1TdnVaaFdZOU9JeWJHMG5GSnBCSjlSdW1BXzR0ZmFmdGM2bkdJTDlGNUswOHhjOE9acHgtOWtCLS1JMk1HYUF5UlZpTGZDelRpdWNDeXdyMkwyTGc4QTg2Q1JDeTA5bXJxaHBOOXNLdEtsT015eDFyWFBYTQ?hl=en-US&gl=US&ceid=US%3Aen,
Game-Changer: How the World’s First GPU Leveled Up Gaming and Ignited the AI Era,Oct 11,NVIDIA Blog,https://news.google.com/read/CBMiX0FVX3lxTE4tRm1LZGRDMmxwSTBtTUp3SUVva1M3bXlqeXBWVDZEYVBUSE1pQ0ViQkJBS3FuUTFqXy1kdDZJVEZ2MThDdGhqNVhkR1o1V2QtTy1jMUVBZjlhOXQwbHJV?hl=en-US&gl=US&ceid=US%3Aen,
GeForce RTX 30 Series Performance Accelerates With Resizable BAR Support,"Mar 30, 2021",NVIDIA Daily News Report,https://news.google.com/read/CBMijwFBVV95cUxQbTFvMnBGeE9Hc3V2NHNQSTI5QmNRTTlaMHJJdWM5ZUxfVW5OdmtoMExJMi02V3k0QzBVZjNqenpfTndxTzFyM3pkRjFmRVVac2xDbU1WWTlYNXhib0VyZjgtVjU4SXcyTG5MdWlBc2VZcF9tVVZocTQ5Q1RhRXMwQ0FHWkRoOTVPam9sZGtlVQ?hl=en-US&gl=US&ceid=US%3Aen,
"NVIDIA Announces Hopper Architecture, the Next Generation of Accelerated Computing","Mar 22, 2022",NVIDIA Blog,https://news.google.com/read/CBMitwFBVV95cUxPZVd2dFc4VW1yM1dkM2k5MnZRNkdrbzgzOVRPbmZwODMtU0RIR0JocmVOUjhCTkswbUlGRldreWNQS25KX3puOTBOc0tiekJHZ3hLa01yeDhNWkdpdV9wTzlCUEkzV1V1Sl9pcVhxZUl4UFY5a2pXQUtLekt3YXlQYmRIR3ZlNGFPZHdZS1FUeG9rUkNPWDJqR2wzSm9HRktRc1FYVVdnYWJrSXhWUE8yUHM0MDhMS0E?hl=en-US&gl=US&ceid=US%3Aen,
NVIDIA App Beta Update Adds AV1 Recording & One-Click Performance Tuning,"Jun 2, 2024",NVIDIA Daily News Report,https://news.google.com/read/CBMikgFBVV95cUxPMndvSU4zOXBjbjJ2ckk1RDF0cDZ0M1FlZS1BbmhTbFQ3eWVqZXloaDRiNjVET3ByckVxcTJpcXl2WDVBYjA3QVR2MFd3Z2g0ZFJQdDFVT3B6ejhlM0NyZzFfaWtiYVBzWm56YWhBNWMzNGFXYldsbEh4WUlzdnJTU05FVW9odWhzTlVqbGJuZVpMZw?hl=en-US&gl=US&ceid=US%3Aen,
NVIDIA Announces Financial Results for First Quarter Fiscal 2024,"May 24, 2023",NVIDIA Blog,https://news.google.com/read/CBMioAFBVV95cUxNNkV3eDkwaFdBWFJDT2xiTVZGNE1pNFNyUndKbHkxOWlZU1VLdnZyT3FEQ3BzRk1VR1VDZmI0TDJIQ1h4UkN1TnZBSWRfWTMtMG5uY0lZOHdLaWJWb05Yc0VMNGdQRGhpbllDWXYyR1YwODVyQW9TV1ZXRkpyaFV1ck50RkVKdnE1RlFRd28yX1J4UklqcUh4aFdsRE12R0NJ?hl=en-US&gl=US&ceid=US%3Aen,
"NVIDIA, ASML, TSMC and Synopsys Set Foundation for Next-Generation Chip Manufacturing","Mar 21, 2023",NVIDIA Blog,https://news.google.com/read/CBMiugFBVV95cUxQcnF1SlZ6eEQ1UFRka3pONWZRVWhabm9Ha1JWV05ZelBubXQ2SDh5STlfOGx0Yy1HSTRFVUthTktiRk96YTJOYTg4YW81aU5KZU5FUXY0RTRCUHRwa0JLU29TUU9rZ0k2NHFscFZ1ajF2TFM1a2llVVc2RFkyb2lub2RpSllvX3d0SVFfWmZIU1h6Q2pDYlpiNEp5ZTcyeThYMmF0dDJNaUlNZ0lGX09BOEJtZGpwNGowSWc?hl=en-US&gl=US&ceid=US%3Aen,
"Game Ready Driver Released For Atomic Heart DLSS 3, THE FINALS Closed Beta & RTX Video Super Resolution","Feb 28, 2023",NVIDIA Daily News Report,https://news.google.com/read/CBMipgFBVV95cUxOMl81d3Nodm5IN1BTNjcxTTZSdDROS0dqMkhzSnZyTlRyZUpQU0daRUJBZEdZY3lERl9ORXZxTXdJUWx2eGtUdUF4Z1pSOG5pdE91U3pWWWdueHJCd3NFUGg1YWRjRS1LbGRIX014Ni1RbGZyZS00SWtjMXlEMGxZRUVQRzRVUFlCaV9EWmxWaExLb0NUaHBDZ3FUZEhhNVJrcFVaa3F3?hl=en-US&gl=US&ceid=US%3Aen,
NVIDIA Launches Generative AI Microservices for Developers to Create and Deploy Generative AI Copilots Across NVIDIA CUDA GPU Installed Base,"Mar 18, 2024",NVIDIA Blog,https://news.google.com/read/CBMigwFBVV95cUxOTWpXN2ZOSkctMi1DOWduRVVJN0RVb2tBaFU1bkNGYTkzNUlncjZiOVY2YlVkZnBLVHhiOE1SM1FIX1ZLTVgydnJadjJULWxpdVBndXl6a202MHpJd1h4ZkF0OWdoU2V0ZWRBWlBzX1I5djZOMWtlUzFmN0JaX0NPNjViTQ?hl=en-US&gl=US&ceid=US%3Aen,
GeForce RTX 40 SUPER Series: New Heroes Debut in the Gaming and Creating Universe With AI as Their Superpower,"Jan 8, 2024",NVIDIA Blog,https://news.google.com/read/CBMib0FVX3lxTE85WE9wMnBHNFViVi1TNXc0Sk9zam1xX1FlS3kwekFlVElLNkNZLWNpQlE0QUktOS1kVVNoT0twcU50VDU2Y2Nra2ZqRFB6ajg2ZFI0cVFwaXEzYU0yZERPZ21nVDF2anJSdzRJUnZfVQ?hl=en-US&gl=US&ceid=US%3Aen,
NVIDIA Announces Financial Results for Second Quarter Fiscal 2024,"Aug 23, 2023",NVIDIA Blog,https://news.google.com/read/CBMiogFBVV95cUxQdTZ2SjE3MlZEVnRScnctOTZfUWFUSmVOX3Bnd29fWXNqYklEM2kyd0EzZVd6RVczMDd1STRoRXdnYTJGLXM2UGNXTU1RTEJhNzU2bURPN2N0SG1SMFNhek13WlZHbzM5X1V5ZlhFbVRxaU4xQUVvU1BYY2hwd29WX0RkdXhuTUxHcktER29GTnRETGg4dHQzY3NwT3BKbVB1T2c?hl=en-US&gl=US&ceid=US%3Aen,
"GeForce RTX 4060 Launching June 29th, Starting At $299","Jun 22, 2023",NVIDIA Daily News Report,https://news.google.com/read/CBMigwFBVV95cUxOSWRRdGk4eU1Jc1pJVWx0WVZJeHpDZEtON29taTJZdG9objlRYWdlXzR4d1l1MmFuQjB4UE5kQ1l0VVFpZlRlbHlBdVZZU2dEUlJTX2JoUkpZanE1RjBZS0hxOUZHYk1fOUNmQkgtX2R4dUk2YlYwWXp2VmkwVFNUQnd4UQ?hl=en-US&gl=US&ceid=US%3Aen,
NVIDIA Brings AI Assistants to Life With GeForce RTX AI PCs,"Jun 2, 2024",NVIDIA Blog,https://news.google.com/read/CBMimgFBVV95cUxPbHQ4U1NrWjJLR0VCWkF5NG8yLWd5dDRSaVZTOFJFbFc4bjBxSUdXaUlWUF9qM2U5dkhqNGtsTGV4SmlwTFFaLTNpUUZxdHVkcUltZHJwdnVSLUFCdzhlN3FJVmNZNjVHaTg5cnVsaXVrUXo4VmtNR0drQTltS1ctaXFvMC1FR1hFY1JrTVJMVFlkODlxaUZuV1dR?hl=en-US&gl=US&ceid=US%3Aen,
NVIDIA Announces Omniverse Cloud APIs to Power Wave of Industrial Digital Twin Software Tools,"Mar 18, 2024",NVIDIA Blog,https://news.google.com/read/CBMihgFBVV95cUxQR1lQMXE3SFMwUHZrUUZVbmRFb0h2YWYtaE1mSDlxejRGakxmZWZQNG5wWnpvbEp2ek9aQl9fV0V2YXpGR21lMWpuX3Jua3F4TmsxajVxOU45WjNQclp3TEJlRDdCSU53LWtlTHUxcjQybmNDYjZYdE1WaW4zY1p3bk10bG9uQQ?hl=en-US&gl=US&ceid=US%3Aen,
"NVIDIA DLSS 3.5: Enhancing Ray Tracing With AI; Coming This Fall To Alan Wake 2, Cyberpunk 2077: Phantom Liberty, Portal with RTX & More","Aug 22, 2023",NVIDIA Daily News Report,https://news.google.com/read/CBMigwFBVV95cUxQMy1NNHh5LV9zSTBpWDlFMTdCN1FMMFZfM2NfRlhTaWpjNkh6c09RT1BwMm03N3dHRDVZRjNKNm54b2lPSmdUYTRkNVozT00zWWJFRnAwZWV0U2dOQ3JVVnE5NURnT2FkN3NEUjdpR3RHbE5sVlZnaXJUQzJwZVl6TjQtMA?hl=en-US&gl=US&ceid=US%3Aen,
Introducing NVIDIA RTX IO: GPU-Accelerated Storage Technology For The Next Generation of Games,"Sep 1, 2020",NVIDIA Daily News Report,https://news.google.com/read/CBMijAFBVV95cUxOZzhXQ1l5V0VUVmNFdklHMnIxa0h0ZzhFMTczbWJHcnprbE9WTjhMWFk1cHc4Skxpc212VDZ4SHlpWVdIZUVRaHRucDI0LWw1cDFySV9UT3lCVzJ4ZFMyUk5WX2pVUmRaOF9YVFI5NzlrSEp2aWpuYnpFdUp5elVHTGdBUTZiNWxLeVhhag?hl=en-US&gl=US&ceid=US%3Aen,
NVIDIA Introduces Grace CPU Superchip,"Mar 22, 2022",NVIDIA Blog,https://news.google.com/read/CBMifEFVX3lxTFBvZG1ydnViX3lYZnhDcXB4cVBSSmNZYmQwcjBpdlMxLTBkSVI3X1dzeGV6OUdybWRaV29ES1JMNGJSTEowVFFaYW5NQ3hYbkN4aHRPV1hZNGxLXzVOWmIxT2o5ZWJpWWVpRDlaYUQyYnhZR3o2TTktdnNtRGw?hl=en-US&gl=US&ceid=US%3Aen,
"GeForce RTX 40 SUPER Series Graphics Cards Launching This January, For Supercharged Gaming & Creating, With Super-Fast AI","Jan 8, 2024",NVIDIA Daily News Report,https://news.google.com/read/CBMiigFBVV95cUxPajkwQjcxejVCa0ticVBEWVR1blZ4VkpUbUw3cVkzbzdBTVhQWHRyMEx4Z3dUZ3kzV243YUxXeWk0b0FyWTlhU0xLSlpXX3g0QmhVaUs1SF9rcXZIVzVPOERxVUoxdXV2SWZBb2RZRVRTUVM2LXBiVXFucFBCRGJkb3VuWXhpUWhwbkE?hl=en-US&gl=US&ceid=US%3Aen,
"GeForce RTX 4060 & RTX 4060 Ti Announced: Available From May 24th, Starting At $299","May 18, 2023",NVIDIA Daily News Report,https://news.google.com/read/CBMidEFVX3lxTE4yR1FlTXNwVk1PMF93d0tlTFZuYjJSaDZLTWhETTBqdzAzajMyVXAxeldvTUpPR2pWbnJDOURKSEJMRjJyZHdNVVNSQkZsREpqWlJQa0o0aTZyOGNLOUNJTlFOcDVGcTdFcThYNFdrWU9EaVhP?hl=en-US&gl=US&ceid=US%3Aen,
NVIDIA Unveils Next-Generation GH200 Grace Hopper Superchip Platform for Era of Accelerated Computing and Generative AI,"Aug 8, 2023",NVIDIA Blog,https://news.google.com/read/CBMiiAFBVV95cUxQMzE4ZWlYbm5sdWN5dGxGRExPbVBnelR0dHVLN2o2MlJvcTc5RU9BbnRDdGtzb2d5T2lIaWgyN05vamY5UTEwa0pyd1ZEam1WX3I1SkdjMWRDbnJGQ204NnFVeWxIOGJpRWhXdVg5VDE0eXlOUnJCUWpWeTFodnhLR3VmSGJKeWFs?hl=en-US&gl=US&ceid=US%3Aen,
High Can See Clearly Now: AI-Powered NVIDIA RTX Video HDR Transforms Standard Video Into Stunning High Dynamic Range,"Jan 24, 2024",NVIDIA Blog,https://news.google.com/read/CBMickFVX3lxTE53UjNpOVJZZFlYamxhX3JjR1RvUktmVjJPTnE3OXpXeWZHWEJMdEE4NWFWRGxVcWlURGxVZlJMN21TR3B6ZndBZVB1RkQ3YmlrZHhHSlY0ZWhMUkZYX2Nld2Z2UXNsMW15MFZqWTdNLTZwZw?hl=en-US&gl=US&ceid=US%3Aen,
"GeForce RTX 4070 Ti Brings NVIDIA Ada Lovelace Architecture To $799, Faster Than The RTX 3090 Ti At Almost Half The Power","Jan 3, 2023",NVIDIA Daily News Report,https://news.google.com/read/CBMib0FVX3lxTE9qaEVfV1pqTHpqNmdCaVFaMFB5c041MFNXUk1nREV6N1gxaEdUSzl0MDM4RzJCb2JnVFlxRmhPMHlzU3ZUZkc5TndCUkN2djJtbUZMNjgtTW9yMnRPbmRneDg2QkJyOVlyT0R5WUNXSQ?hl=en-US&gl=US&ceid=US%3Aen,
Introducing Project G-Assist: A Preview Of How AI Assistants Can Enhance Games & Apps,"Jun 2, 2024",NVIDIA Daily News Report,https://news.google.com/read/CBMickFVX3lxTFBVb01odWtOeW9wa2ZnY1ByWEFoMUpFLUliQ0pDZmptbXBVeEE3QUEtYURXOTJ0cldBOS04MllnbC1sMmlXMWV4S3haSTJYVnVTWThnY0RHMnFodHpfQmRCbXVqUkh4dUE1eUhCZ2UyaFdPdw?hl=en-US&gl=US&ceid=US%3Aen,
"‘Accelerate Everything,’ NVIDIA CEO Says Ahead of COMPUTEX","Jun 2, 2024",NVIDIA Blog,https://news.google.com/read/CBMiaEFVX3lxTFBNVE51RVY5ZjhXQldMeV9lNF8tYnRhdUdqbl9Nd2RxenBqLWN0cS1PRFBTYjFCaXVQQ1NhTk9jS2pzWDFhdm9TWnpDd2tyZEp5cUJGXzE5LVdKblA3Y1RLYTRsV0VCRVRE?hl=en-US&gl=US&ceid=US%3Aen,
Introducing GeForce RTX 40 Series GPUs | GeForce News,"Sep 20, 2022",NVIDIA Daily News Report,https://news.google.com/read/CBMijgFBVV95cUxNN2ZJSnF6M19YY3o1NzdsSUlkVlQ1eGpZbVlEdUtUak1fdmtuZWFXYzd4N1F6MGUxQlIwYnoxQy1TenhYcjd0RDd1TlEtcEY1Nmt5LWNSTmZwcTltdGRXUTZxYTBBaXE5dUozQUwydzNudVp0aDdTUGwwZXQ5V24xNDJyZGpiUmp2RUtWY3h3?hl=en-US&gl=US&ceid=US%3Aen,
NVIDIA Announces Financial Results for First Quarter Fiscal 2025,"May 22, 2024",NVIDIA Blog,https://news.google.com/read/CBMioAFBVV95cUxQclk1bTBCcnZoaEZxdHRRSmticG9Kd0NhTkdzWGliX1Z0NEZYRTVlVzNVVEhfNzh2bGUyc0N6Zkx6U1djMmQ5TUR5eGFMWnNhNjhhSUQ3N0NCcjRNckJhVk1laGJCZURIUk1lY0xITFdicFJoTDNIcWU5ZTY3LUFmbmJHMnlvbHFKbVBJUzgyaS1SUGE0NGdqajJuQjA4N3VO?hl=en-US&gl=US&ceid=US%3Aen,
"NVIDIA GeForce RTX 4070 Brings Power of Ada Lovelace Architecture and DLSS 3 to Millions More Gamers and Creators, Starting at $599","Apr 12, 2023",NVIDIA Blog,https://news.google.com/read/CBMi9wFBVV95cUxQc0RVR0YtRkpvQnQ3MHBLbTRZZExMQkJnNENoazZfUVI4dDk2bF9WdGNmcVVla0lZRERGaWF5RFU3czVqMFNNUDBoNmFVc0V3VnpMVHNfOXhaa1B2bGRFMTNCa0Z0YnMtcUxRQ01kUDlxQmVhLTFEQ295c0pBNmRKaXFjR3E4YmdhY2xacE5JaVYwWkw1VlEzUE5jcV9NTm1id2t6bEZIdVpmT1Y0cVdHaGQwR3RvZ3BXVlJMVi12cjVfMUptV3RoWkpzYVpTdVFVR0thTzVUdG9GY2VWUlFRbDFhZnVsREd2NUhpMEJNZmVZVVdrQUtv?hl=en-US&gl=US&ceid=US%3Aen,
NVIDIA Accelerates Humanoid Robotics Development,Jul 29,NVIDIA Blog,https://news.google.com/read/CBMimAFBVV95cUxQMDZkaGRFQ3FTVUZHNjIxTTFKVEoxallOeW5kNG5QQ01LVVpEN3ZMem5NbGhubDdjenRicFg4R2ZDUUljRmIyV2E0Q3ZzLVNLVDNaVVBsQno0bDF0dmdmR1U3ekxoQVhuZF8zSGdma3d4QWhJVUQxc0dGb2k4YmtlNmNuOVNmSnUxcmlDWUE1YzY0eGtOYnBQVw?hl=en-US&gl=US&ceid=US%3Aen,
Diablo IV GeForce Game Ready Driver Released,"May 30, 2023",NVIDIA Daily News Report,https://news.google.com/read/CBMiekFVX3lxTE1YUVBDWDNyTXBaWlkxUGR3UGpKWHJFM1YzS0dhcW05VzY5akkwWDJRSGdpbDN1WEdwYkU3OXQxdXQ4N3RiRm1pVzdDV0F2NXZpdkZzbVQ4MkpEOTRUeGtpeXpvTmVnWTFFY2prY0xDdHJpeDFCQmdNdHVB?hl=en-US&gl=US&ceid=US%3Aen,
"NVIDIA Brings Generative AI to Millions, With Tensor Core GPUs, LLMs, Tools for RTX PCs and Workstations","Jan 8, 2024",NVIDIA Blog,https://news.google.com/read/CBMifkFVX3lxTFBmNDdBVzdmY3V4czAybVBtMFlfTWg5aEduSHN6dUFaREROY3pxWlF4ek0tQTVuZ2hPSXE2MEU4dGVMZnpkWHY1R2gyNnNmTVpDdlJjOWRHY2I1eVdycVdoRnR3cmZyTkNQSXVrQ1NKenZkRmhKTVVWNTFzZm83QQ?hl=en-US&gl=US&ceid=US%3Aen,
NVIDIA Announces Financial Results for Second Quarter Fiscal 2025,Aug 28,NVIDIA Blog,https://news.google.com/read/CBMiogFBVV95cUxPX3JXMExqclZfcUlCNmxSbWNTdE5kZnBDdTZKOXhId0JsWERnVWFLVkVGcUtncGktcGZhN0tORU92cTdpejZWYTNKZVRCeF9PTkowMWZSdEZxdnJ0enROLXo3OHhvX3VNbWNQblBVVl85T3RHdER2S0paU2I5VDRoSExpa3FEbmFWNHV0NjRsZXh4ZlpuMEY0ajBJa2xnUVVFcUE?hl=en-US&gl=US&ceid=US%3Aen,
"Announcing Half-Life 2 RTX, An RTX Remix Project Being Built By The Community","Aug 22, 2023",NVIDIA Daily News Report,https://news.google.com/read/CBMihgFBVV95cUxOS2tTWDl1OXhVblpOcXcxLXZYNGYwdUxNZ0lVcUdTc2dTN3o5TUpadE9QSFA0cjZnNm81RkRPNFptN1JUWWFVV01tbXp0ZTZqT19wSVBMWl9wRHRWV0ZNQUtkRVFvOEFHNmVESlpnSDhIbHZoVkNvVUFNRmhJSE9EMG9XMmFyUQ?hl=en-US&gl=US&ceid=US%3Aen,
Welcome to GeForce NOW Performance: Priority Members Get Instant Upgrade,Nov 7,NVIDIA Blog,https://news.google.com/read/CBMif0FVX3lxTE02cGFrNl9qX0NtWU9YQUNLYUpoV3oxR1BjRUVKTmVXdElTZGVFeE12d2N6N2hzNExnZGRQM3Zsdk93OFNUX2ZpNUx3N3Y1VkdSdlVsck5uQW5aRFRIZUNfdVE2UjdrQ2FiWkFZbmdYbU9SVG9LNTBmQTUyY0EyNEE?hl=en-US&gl=US&ceid=US%3Aen,
MediaTek Partners With NVIDIA to Transform Automobiles With AI and Accelerated Computing,"May 28, 2023",NVIDIA Blog,https://news.google.com/read/CBMidkFVX3lxTFBBcUlDQlczcHczWkR5ajJDN3pTNUdDNmQ2M0QxUnVnUFhmQVNwbGRGdUdfM0E0ZXRucHBERzBEeUQwSFNjZmVKRzRfd05TdzZMcTJYS1hFNmxuYmM2OHpOTFVlTnY2OC1PMmN2N1hKYUlPeGRNN0E?hl=en-US&gl=US&ceid=US%3Aen,
"NVIDIA to Acquire Arm for $40 Billion, Creating World’s Premier Computing Company for the Age of AI","Sep 13, 2020",NVIDIA Blog,https://news.google.com/read/CBMiygFBVV95cUxNZnhpdDk4WGJpSjRwa2p5LVpla2VlVWRnRXBQQ3lsYm1fd0hDMHVERVFXbk5GWEJXcTBvTl9BMF92aVZKdW5RRWFXcWJ2WkZGcmNhUTBET1daaDMxOXktaTNHWEpUN2RkUVlXdWlGWkZjYl9yYURWWDE0UTBOeUd0ZHFFeGdtR3k5ak9oOGtZUzRrTzdyZzc3N0lRQ2JSaFpweFZCWE9FMGtPTkZsUWNUQlNTTDIwT0dWRlpOQW9ILVg2Rko5S2o3emNB?hl=en-US&gl=US&ceid=US%3Aen,
Black Myth: Wukong & Star Wars™ Outlaws GeForce Game Ready Driver Released,Aug 20,NVIDIA Daily News Report,https://news.google.com/read/CBMipwFBVV95cUxNSXhMUmVGcVpmbHp5LUQxVl9qU1Y1R3M1UGdYYk5pdXBpeTNWaHozYnZkRTJWMmlXSzhGOEtJTVlnWHB6MXBnNVRseDlpeWF1Nkt1Q1FQWlpZWnhFRTViSnMyaGh6R3pxa002endKblBkSW1vQi1LRHBlSXM0d1A3T1E5QzFXYVRNVVZVLTMzUnEwbDBITzdqeDVDdkRJVFlqeF9OazJZcw?hl=en-US&gl=US&ceid=US%3Aen,
NVIDIA Announces DGX GH200 AI Supercomputer,"May 28, 2023",NVIDIA Blog,https://news.google.com/read/CBMihAFBVV95cUxNT2UxRWxaMkQ1REJSMC1YWHA3aENTUzNWeFlkb3NjY2VBWTcydFpXalZIREc2cjdfa19hLTBKS2Jndk9pTHVVaVNubUhjamJpaTd6SUkyNTdGTVZ5cnA3Rjdmc1lkNmhreWszTUhWNnlaMmRVMFAzY1dmWFlYMGFSNzFrQUQ?hl=en-US&gl=US&ceid=US%3Aen,
Celebrate Half-Life 2’s 20th Anniversary With A Tribute Video & A New Look At Half-Life 2 RTX,Nov 14,NVIDIA Daily News Report,https://news.google.com/read/CBMijAFBVV95cUxOMFR3NFdCZXpyMmhtVEdvSURrc2h6OGhtelB5VGVkNklTT1BWMmpjWXduS01nU0JwRDhRbG55OWk4Xy14eXZjWFZHVkJzUG9UNk1KX3NZa2JJWW80YVRUOTdMSGpYTEdyb3duTDVGcVVrZW84blRSM1otWG1uWnEtc3M5SEh1djZENkd3aA?hl=en-US&gl=US&ceid=US%3Aen,
"Level Up: NVIDIA, MediaTek to Bring G-SYNC Display Technologies to More Gamers",Aug 20,NVIDIA Blog,https://news.google.com/read/CBMiZkFVX3lxTFBjZ3ZacDQxOHdiVDlDWE9iX1pTY2NlUXJreFM4X21tVURHX1NtMnhEczVtamZpUUFJMER5SnFxOFFyQkdMYUYwQnQtbkJzZDVzUjlZS1dEZ2hxZDhZNmI2bk9vVjVTZw?hl=en-US&gl=US&ceid=US%3Aen,
"Introducing GeForce RTX 4070: NVIDIA Ada Lovelace & DLSS 3, Starting At $599","Apr 12, 2023",NVIDIA Daily News Report,https://news.google.com/read/CBMia0FVX3lxTE11TjRlbmxOZExJOXQ5UkdXb09mZ1ZVVl9aN3BxdHExMjFiYW9wdk1qRTVwU013RnJQV1UxeWpCZ0tEdWxmZkR5c2VvME1jUHhpNWJja3N0MDJfSVpQTTVfQjFvQkdBS0tpWUtn?hl=en-US&gl=US&ceid=US%3Aen,
NVIDIA RTX Remix Open Beta Available Now - Remaster The Classics With RTX,"Jan 22, 2024",NVIDIA Daily News Report,https://news.google.com/read/CBMijwFBVV95cUxQZ2U1VmtEU0RMZzJqMjNLQ1lDSENLQmJwRThvTkk2ekRpX084TVBRNE1Sa1g4U2w5LTZ1ZG9tbFV1YUd4ckk2azhRYjA1OFl4bEFWeTJkMEtsbEtYd2JJNkg1OUp2WlZEcXVtdkFIMGtGTGg0Zy1RODJFLWhYM1RQYVVNTFllUWt4aUswY1VOWQ?hl=en-US&gl=US&ceid=US%3Aen,
Counter-Strike 2 with NVIDIA Reflex and GeForce RTX 40 Series GPUs - The Lowest System Latency & Highest FPS,"Sep 27, 2023",NVIDIA Daily News Report,https://news.google.com/read/CBMilwFBVV95cUxPWURHLVhPM1Ywd3p1ZER5YUJGOUtlNDlUWDdudGtjOUdwLWl2aUsxT2EtVEJrLXRFMVFBS1IxQm9JMXBSbEE5NHRJT3ptNTlGV0xUMlBtUDJITDhnRkJtUTdaUDdnVV82VGRKNVJBVndrMFFfUXJPMHhRaHhNN3p4ZmtvN25zdlhOZGd2S01JYVhRY2Yxeksw?hl=en-US&gl=US&ceid=US%3Aen,
